And so what if it is a rebound relationship for both of you?	What if it is a rebound relationship for both of you?	Is it a rebound relationship for both of you?	So what if it is a rebound relationship for the two of you?	What does it matter if it is a rebound relationship for you both?
Good luck in your search for the one!	Good luck in your search for your perfect match.	Good luck in your search for a new love.	Good luck in your search for the one!	"I wish you luck in your search for ""the one""."
WHY DOES EVERYONE SEEM TO WANT SOMEONE THAT THEY CAN'T HAVE AND KNOW THAT THEY SHOULDN'T WANT.	Why does everyone seem to want someone that they cannot have and know that they should not want?	Why do people seem to want someone they can not have, and know they should not want?	Why does everyone seem to want somebody that they cannot have and know that they should not want.	Why is it that everyone seems to want someone that they can not have and know that they should not want?
Do you like to argue and fight???	Do you like to argue and fight?	Do you like to argue and fight?	Do you like to argue and fight?	Are you someone who enjoys arguing and fighting?
So if you're set on that, that's the way to go!!	If you are set on that, that is the way to go.	If that is your decision, then that is what you should do.	So that is the way to go if you are set on that.	If you are set on that, then that is the way to go.
My ex of 3 years cheated.	I went out with my ex for three years and then he/she cheated.	My ex of three years cheated on me.	My three years ex cheated on me.	I dated someone for 3 years and they cheated on me.
Work at it but don't let him keep you locked up at home.	Work at it and do not let him keep you locked up at home.	Work at it, but do not allow him to keep you locked up at home.	Work at it but don't let him keep you locked up at home.	Work on your relationship, but do not let him keep you locked up at home.
>>Other than those two things, just ask him once in a while.	Other than two questions, ask him just once in awhile.	Other than those two things, ask him once in awhile.	Other than those two things, just ask him once in a while.	Ask him how he is once in a while.
Also men get bored and tire way before woman do.	Also, men get bored and tired a long time before women do.	Men get bored and tired before women do.	Also men get bored and tire way before women do.	Men get bored before women do.
She's strong and loving and most of all...really wasn't as happy as she thought she was.	She is strong, loving, and wasn't as happy as she thought she was.	She is really tough and loving and above all...really was not as happy as she appeared to be.	She is strong, loving, and was not as happy as she thought.	She is strong and loving and most of all really was not as happy as she seemed to be.
its one way of saying i don't like you!	It is another way to say that they don't like you.	It is one way of stating I do not like you!	"It is one way of saying, ""I do not like you."""	It is one way of saying that you do not like them.
King had a song about this - Only your Mother loves you (and see might be jiving too).	"King has a song about this, it is called ""Only Your Mother Loves You."""	King did have a song about this=Only Your Mother Loves You (and find Might be Jiving too).	"King made a song about this: ""Only Your Mother Loves You (and She Might be Jiving Too)."""	"King had a song about this:""Only your Mother Loves You (and she might be jiving, too)""."
He loves you, too, girl...Time will tell.	He loves you as well, but only time can tell what will happen.	He loves you too, lady...time will tell.	He loves you, as well. Time will tell.	He loves you too and time will tell.
he wants me to change how i look.	He wants me to change my appearance.	He wants me to change how I look.	My partner wants me to change my appearance.	He wants me to change how I look.
I know I have someone to come home to.	I relish the fact that I have someone to come home to.	I know I have someone to come home to.	I know I have someone who will be waiting when I come home.	I know I have someone, to whom I come home.
did you fell goog because i want to have sex, but you have to be careful	Sex can feel great; but, you have to be careful.	I do not know if you fell down, but I want to have sex.	I want to have sex with my partner, but we must be careful.	Did it feel good? Because I want to have sex, but you have to be careful.
you want all your friends forever?)	Do you want all your friends to be with you forever?	Do you want to keep all of your friends forever?	Do you want all your friends forever?	You want all of your friendships to last forever?
IT DOESN'T MEAN THAT YOU ARE SLUTTY.	It does not mean that you are a loose woman.	Acting that way does not make you a slut.	That does not mean that you are promiscuious.	It does not mean that you are loose.
Going to a club and dancing.	You could try dancing at a club.	I enjoy going to a club and dancing.	You can try and go to a club and dance.	I am going to a club and dancing.
Don't go anywhere you went with him or her.	Do not go any place you went with him or her.	Don't go anywhere with you new date that you went with your ex.	Do not go to any place that you went with him/her.	Do not go anywhere you went with him or her.
They're a lot of fun - there's plenty to do.	There is plenty to do and they are a lot of fun.	Going there is great fun, and there are plenty of things to do.	There is pleanty to do, and it is a lot of fun.	They are tons of fun and plenty to do.
it all depends on when ur ready.	It all depends on when you are ready.	It will all depend on when you are ready.	It all depends on when you are ready.	It depends on when you are ready.
Stay 100 miles away from this guy.	Stay 100 miles away for this man.	Stay very far away from this man.	Stay one hundred miles away from this guy.	Stay 100 miles away from the man.
Just be prepared cause if it happen once it can happen again!	You have to be prepared that if it happened one time, it can happen again.	You should be prepared because if it happened once it could happen again.	Just be prepared because if it happened once, it can happen again!	Be prepared, because if it happens once, it can happen again.
I'm just looking for the girl who wants that time with me	I am looking for the girl who want to spend time with me.	I am looking for the girl who wants to spend time with me.	I am looking for a girl who wants to spend time with me.	I am looking for a girl who wants to spend time with me.
Least not till he gets another girlfriend.	At least not until he gets another woman friend.	At least not until he finds another girlfriend.	Probably not until he finds another girl.	He will get another girlfriend.
Wife says, We don't wear that shit.	"The wife says, ""We do not wear that."""	My wife says we don't wear things like that.	The wife told me that we do not wear that.	My wife does not like to wear those brands.
if you're asking, then you should break-up w/ and open yourself to other options.	If you are asking, then you should break up with him/her and then open yourself up to other options.	If you are uncertain, you should break up and open yourself to seeing other people.	If you have that question, then you should break up and open up to other options.	You should break up and keep yourself open to other options.
why do gays want to get married?	Why do homosexuals want to get married?	Why do same-sex couples want to be married?	Why do gay people want to get married?	Why do homosexuals look to marriage?
(saying sorry to him without commiting a mistake is humilation to ur self...AND DON'T EVER GET WEAK!!)	Do not apologize if you have not made a mistake.	Don't say sorry to him unless you've actually made a mistake.	You will just humiliate yourself if you apologize to him without committing a mistake. Do not get weak!	Avoid being weak by not saying sorry for something you did not do.
do you have to rush your choice?	do you have to rush the choice?	Do you have to rush this decision?	Do you have to make a fast choice?	Take time to decide.
THEY BOTH DONT RESPECT YOUR FEELING.	Both of them do not respect your feelings.	They both disrespect your feelings.	They both do not respect your feelings.	They do not respect your feelings.
No seriously, think about howmany cocky girls are out there.	No seriously, think about how many arrogant women are out there.	No, seriously. Think about how many arrogant women are out there.	I sincerely urge you to consider how many overly confident women exist.	No, seriously, think about the number of arrogant girls that are out there.
She is too afraid to ask him out.	She is too shy to ask him out.	She is frightened about asking him on a date.	She is too frightened to invite him on a date.	She is too scared to ask him to go out.
get a grip, how can you love someone that you don't even communicate with.	Get a brain, how can you love someone that you do not even communicate with.	Get a grip! How can you love someone, with whom you cannot even communicate?	Accept reality. How can you love a person with whom you do not even communicate?	Get a hold of yourself, how could you love a person that you do not even speak to?
i'd ask you out, but i live in Oregon and have no idea where you live...	I would ask you out, but I live in Oregon and have no idea where you live.	I would ask you on a date, but I live in Oregon, and I have no idea where you live.	I would invite you on a date but I live in Oregon and I am entirely uniformed as to where you live.	I would ask you to go out, but I live in Oregon and I have no idea where you live.
they have never proformed before and it doubles the plesure!	They have never performed before, and it doubles the pleasure.	They have never performed before, and it doubles the pleasure!	They have never performed before and this doubles the pleasure.	They have not performed previously and the pleasure is twice as nice!
i'll probably go and see one.	I will probably go and see one of them.	I will go and see one.	I will likely go and see one.	I will most likely go and see.
Either way, best of luck but I'm just glad that I have brown hair!!	In any case, I wish you best of luck although I am glad that I have brown hair.	I am happy that I have brown hair.	Either way, best of luck to you, however, I am glad that you have brown hair.	Ether way, I wish you the best, and I am happy that I have brown hair.
Mail me a pick honorarius@yahoo.com and I will tell you...	Send me an e-mail at honorarius@yahoo.com, and I will let you know.	If you email me, I can tell you the answer.	Mail me a photo to my email address honorarius@yahoo.com and I will tell you.	Send me a picture of you, and I will let you know.
it is absolutely just a challenge!!!!!!!!!!!	It is absolutely a great challenge.	It is a challange.	It is absolutely a challenge.	It is just a challenge.
well-im  girl so ill help u out.	I am a girl so I am will to help you out.	I will help you.	Well, I am female, so I will help you out.	I am a girl, so I can give you some advice.
Dont tell them but let them find out once your in bed with her.	Do not inform them but allow them to discover it once you are in bed with her.	Do not let them know in advance but rather allow them to discover once you are in bed together.	Don't state it specifically, let them figure it out when you're together.	Don't tell them but let them find out once you are in bed with her.
if i would've kept my last name its just a freakin name.	If I would have kept my last name. It is merely a name.	I should have kept my last name.	If I could, I would have kept my last name.	If I would've kept my last name its just freakin name.
i hardly everrr see him in school either usually i see hima t my brothers basketball games .	I rarely see him in school either, I typically see him at my brother's basketball games.	I rarely see him in school but I have seen him attending my brother's basketball games.	I hardly ever see him in school, usually I see him when I go to my brother's basketball games.	I hardly ever see him in school. I usually see him with my brothers playing basketball.
he's telling that to some gurls too... he's a womanizer..	He is stating that to some women as well. He is a Lothario.	He is a womanizer and has been telling that to some young woman.	He is telling that to some other girls as well.	He is telling that to some girls too because he is a womanizer.
DROP HIS BUTTT, THERE ARE PLENTY OF FISH IN THE SEA OF AMORE:0)	Leave him, there are plenty of men out there.	Break up with him. There are plenty of fish in the sea.	Reject him. There are many options for romantic partners.	You need to leave him; There are plenty of people to find while looking for love.
I know because I am just like your wife.	I know this because I have a similar personality to your wife.	I know, because I am like your wife.	I know because I am exactly the same as your wife.	I am aware because I am just like your wife.
when she calls, text her back	When she calls, text her back instead.	When she calls, you should text her back.	When she telephones, respond with a text message.	When she calls you, send her a text message back.
No way im 5`4 and he`s 6`2	No, I am 5ft 4inches and he is 6ft and 2inches.	"No way, I am only 5'4"" and he is 6'2""."	Not at all. I am five feet four inches tall and he is 6 feet 2 inches tall. `	No chance, I am five feet four inches tall and he is six feet two inches tall.
Dont you know the number one rule, Trust No One.	Don't you know the cardinal rule is to never trust anyone?	You do not know the first rule, trust no one.	Do you not know the most important rule? Trust no one.	Do you not know that the number one rule is to trust no one?
we've tried breakin up a couple times but it never happens.	We have tried to break-up a couple of times, but it does not happen.	We've attempted to end the relationship on several occasions however we never succeed.	We've tried to break up several times, but we can never manage to make it stick.	We have tried breaking up a couple of times but it never happens.
Oh and some because theyre thin and skinny and nowadays anorexic girls are a turn on.	Also some who are thin and skinny because these days anorexic girls are attractive.	Oh, and a portion due to them being slender and slim and these days young women suffering anorexia are sexually exciting.	Some people are attracted to thin and skinny people because the anorexic look is in.	Oh and some because they are thin and skinny, and these days anorexic girls are a turn on.
if u have penis than its no problem u just hv to  penitrate her pussy with ur errect penis.	You would use your erect penis to penetrate her vagina.	Given that you possess male genitalia, it isn't an issue. You are simply required to insert your engorged member into her vagina.	If you have male genitals, then it shouldn't be a problem, just penetrate her genitals when you become erect.	If you have a penis then it is no problem; you just have to penetrate her vagina with your erect penis.
in that case tkake some defense classes.	In that case, you should take some defense classes.	In such a circumstance, enroll in some self-defense courses.	May I suggest taking some self defense classes?	In that case, take some self defense classes.
I just got out of a 3 yr relationship with my baby's father.	I just ended a three-year relationship with the father of my baby.	I just escaped a three-year romance with the father of my newborn.	I just left a three year relationship with my child's father.	I just got out of a three year relationship with my baby's father.
what happened when the politician took viagra?	What happened when the politician ingested viagra?	Want to hear a bad joke?	What happened to the politician when he took Viagra?	What happened when the politician took Viagra?
Hi, my name is xxxxxx  Been working for me for years.	Hello, my name is xxxx has been working for me for years.	I have been working for years.	Hi my name is going to remain anonymous, but I have been working together with this person for years.	"Hello, my name is ""xxxxxx"" and it has been working for me for years."
i can onli say...women r complicated...	I can only state that women are complicated.	Women are coomplicated.	I just feel that woman are complicated.	I am only able to say that women are complicated.
We like soft approch and a lil bit of chasing.	We enjoy a gentle approach and a tiny bit of chasing.	We like a soft approach with a little chasing.	We like to be approached softly, with some slight chasing.	We like a soft approach and a little bit of pursuing.
you would be genuinly suprised in the type of people that go to them.	You would actually be surprised at the kind of people that go to them.	You would be suprised at the type of people that are interested in them.	You would very surprised to see the type of people that are attracted to him.	You really would be surprised by the types of people who go to them.
it is very fun and enjoyable especially when you meet each other after texting a few months	It is invigorating, especially when you meet each other again after texting for several months.	It is very enjoyable, especially when you meet each other after exchanging text messages for a few months.	It is very enjoyable, especially when you finally meet after texting for a few months.	When you meet each other after texting for a few months, it can be very enjoyable.
Hey, I'm in NYC I'll help you out if your around!	I am in New York currently, I'd love to show you around if you'd like.	I am in New York City. I will help you if you are nearby.	I am in New York City and will help you out if you are around.	Hello, I am in New York City, I will help you out if you are available.
Sounds strange but it worked in about 3-5 days for me!	It sounds strange, but it worked in 3-5 days.	It sounds strange but it worked in about three to five days for me.	It sounds strange but it worked in three to five days for me.	It sounds strange, but it worked for me, in about three to five days.
Don't worry, I aint working with much either.	Don't worry, I don't have that many option myself.	Do not worry, I do not have much to work with either.	Do not worry as I am not working with much either.	Do not worry, I am not working with much either.
why does it matter what they think if they dont get along dont spend time togather.	Why does it matter what the think, if they don't even take the effort to get along or spend time together?	Why does their opinion matter? If they do not get along, then do not spend time together.	If they do not get along, then do not spend time with them and do not worry what they think.	If they do not get along, then they should not spend time together.  Why does it matter what they think?
if he is then you have a good man.	You have a good man, if he is.	Should he behave as such, you are in possession of a quality male!	If he is, then you have a wonderful partner.	If he is, then you have a good man.
If He Likes You, You'll Know!	You will know if he is attracted to you!	If he has affection for you, you will be aware!	If he is interested in you, you will just know.	If he likes you, you will know it!
i guess its normal, but id just move on	I suppose it is normal, but I would just move on.	I imagine it's common, however, I'd simply proceed.	I guess that it is normal, but I would move on.	I guess it is normal but I would just move on.
The rest is easy from there!!	From there, the rest is easy!	The remainder is simple from this point forward!	The rest becomes easy after this.	The rest is easy from there.
I like any guy that is funny.	I am attracted to any man that is funny.	I am fond of all gentlemen with a sense of humor.	I like a man who is funny.	I like any guy that has a sense of humor.
Girl only you can decide on this...	Only you can decide on this, woman.	Young lady, you are the singular person capable of rendering this decision.	Only you can decide on this issue.	You are the only one who can make this decision.
Why do you ask this question??????????????	Why do you ask this question?	What's the reason for posing the query?	Why are you asking me this question?	Why did you ask this question?
do go telling everyone just because you think thats right.	Do not go telling everyone, just because you think that is the right thing to do.	Proceed to inform all simply due your belief that it is correct to do so.	Do not tell everyone, just because you think it is right.	Don't just spill everything because you think it is right.
10 years gap is just nice.	A ten-year gap is just nice.	Ten years' separation is simply appealing.	!0 years is a nice age gap.	A ten year age gap is nice.
Then if he still doesn't like you, then move on.	Then move on if he still does not like you.	After that if he still does not like you, then you need to move on.	Then if he still does not like you, move on.	If he still does not enjoy your company, move on.
ok i see him ever week in psr but i just cant talk to him!!!	I see him every week but I just cannot talk to him.	Even though I see him each week in PSR I can not find the courage to talk to him.	Okay, I see him every week in PSR, but I just cannot talk to him.	Okay, I see him every week in PSR, but I just cannot speak to him!
Beacuse they feel insecure with less educated guys..........	That is because they feel insecure with less educated men.	Because they feel less secure with men who are less educated.	They feel insecure around less educated men.	Because they do not fell secure with uneducated men...
For one thing if it doesn't work out there goes your job.	For one thing, there goes your job if it does not work out.	One reason is that if it does not work out you could lose your job.	For one thing, if it does not work out, then there goes your job.	For one thing, if it does not work out, you lose your employment.
And I hope to God it doesn't ever pass!	And I just pray that it never passes!	Also I pray that it does not ever pass.	I hope that it does not ever pass.	I hope to the Creator it does not ever pass!
Only the ones that aren't worth your time	It is only the ones that are not worth your time.	Only the ones that are not worth your time.	Avoid the ones that are not worth your time.	Only the ones that are not worth your time.
smaller of course, and it is all about LOOKS!!	Smaller, of course, and it is all about looks!	Smaller of course, and it is all about how they look.	It is about the looks.	Smaller of course and it is all about attractiveness.
You guys don't have any reason to hate each other.	You guys do not have any reason to hate each other.	You guys do not have any reason to hate one another.	There is no reason for you two to dislike each other.	You all do not have any excuse to dislike each other.
If you don't you'll always wonder.	If you do not, you will always wonder.	If you do not. You will always wonder.	If you don't ask the question, you will always wonder about the answer.	If you do not you will always wonder.
Some people choose not to because of thier religion, others don't.	Some people choose not to due to their religion, others do not.	People choose not to because of their religion, while others do not.	Some people choose not to do that because of their religion.	Some people choose not to because of their religion and others do not.
give it a chance because if you break up with them it would be harder to be friends	Give it a chance, if you break up with them it will be harder to remain friends.	Give it a chance, because if you break up with them it would be harder to be simply friends.	You should give it a chance.  If you end up breaking up with that person, it will be harder to be friends with them.	Give it a chance because if you break up with them it will be harder to be friends.
The Best of Luck to ya!	Best of luck!	Best of luck to you.	I wish you the best of luck!	I wish you the best of luck.
Men who were not ready to committ.	Men who were not ready to commit.	Men who were not ready to commit.	I do not like being with men who are not ready to commit to a relationship.	That was men who were not ready to commit.
this is a big day in both of your lives, it shouldnt be done quickly and without thought.	This is a big day in both of your lives and it should not be done quickly and without thought.	It is a big day in both of your lives, it should not be done quickly or without thought.	This is an important day in both of your lives. It should not be done hastily or without consideration.	This is a big day for both of you, don't be so rash in you decisions.
i'm 55 years old and still live at home with my mammy,whats wrong with that!!!!	I am fifty-five years old and still live at home with my mother, what is wrong with that?	I am 55-years-old and still live at home with my mother. What is wrong with that?	I am 55 years old and continue to live at home with my mother. What is wrong with that?	I am 55 years old, and am still living with my mother, why is that wrong?
one man willing to move 21 hours/1,400 miles just to be with me.	One man willing to move twenty-one hours and fourteen hundred miles just to be with me.	I want one man willing to move 21 hours and 1,400 miles away to be with me.	One man is willing to move 21 hours or 1,400 miles simply to be with me.	I have a man willing to move 1400 miles to be with me.
I must not be ugly enough then	I must not be unattractive enough.	I must not be unattractive enough, then.	I must not be unattractive enough in that case.	I must not be hideous then.
but thats ok. im a GIVER.WINK, WINK.	That is alright, I am a giver.	That is alright. I am a giver.	However, that is fine. I am generous, if you understand my implication.	That is okay, I am generous.
