the two of you should talk privately and personally...you have to clear each other's side..do it now	Both of you should speak privately and personally, you need to clear each other's side, do it now.	The two of you should talk privately and personally. You have to hear eachothers side.	The two of you should talk privately. You have to clear each other's side of the story up, now.	The two of you should talk privately and personally. You have to clarify each other's side, so do it now!
Well, the one I liked goes like this.	Well, the one I enjoyed goes something like this.	The song I liked went like this.	Well, the one I enjoyed goes like this.	Well, the one I enjoyed went like this.
Do not try to have sex.	Do not attempt to experience sexual relations.	do not try to have sex.	Do not try to have sex.	Try not to have sex.
just keep it cool, a little hard to get might help!	Just stay calm, a bit of hard to get may help!	You should play a little hard to get.	Keep it calm and a little hard to get. I may help.	Just keep it cool. It might help to be a little hard to get!
if your relationship survive the four seasons... i guess you should be ready....	If you relationship lasts a year, I would assume you should be ready.	I believe you should be ready even if your relationship survives the four seasons.	If your relationship survives, you should be ready.	"If your relationship has survived the ""four seasons"" I suppose that you should be ready."
I married my guy anyways and do you know why (besides love).	In any event, I married my husband, and wonder if you know the reasons in addition to love.	Do you know why, besides love, I married my man.	I married my guy. Do you know why?	I married the man I was with anyway, and do you know the reason other than love?
move on and find someone who doesn't hate you.	You need to move on and enter a relationship with someone who does not hate you.	Move on and find someone who does not abhor you.	You need to move on and find someone who does not hate you.	You need to move on and find a person who does not hate you.
YOU CAN'T, so lets just start asumming it.	You cannot, so let us operate on an assumption.	Let us start assuming it since you cannot.	We can just assume so.	You cannot, so let us just began assuming so.
yes we like flowers, pretty, good smelling ones	Yes, we like flowers that are pretty and smell nice.	Of course we like pretty, good smelling flowers.	We like pretty, good smelling flowers	Yes, we like pretty, pleasant smelling flowers.
should i or shouldn't i. younger guy vs older woman	Should I date him or not?  It is a younger guy vs an older woman.	Should I try this relationship, younger man versus older woman.	Should I, or should I not? Younger guy versus older woman.	Younger men and older women, good idea or not?
ok, those other replies are just cocky, i'm way more FINE.	Those other replies are cocky.  I am a much better person.	Alright, these other replies are presumptuous, I am much more accomplished.	Alright, those other replies are simply arrogant. I am way more attractive!	Those replies are arrogant, I am much more attractive.
lime green would be more for a summer wedding.	Lime green would be best for a summer wedding.	Lime green is a better color for a Summer wedding.	Lime green would be more appropriate for a Summer wedding.	Lime green is more of a summer wedding color.
but if they cannot exercise self-control, let them marry.	But let them marry, if they cannot exercise self-control.	If they cannot exercise self conrol, allow them to marry.	However, let them get married if they cannot control themselves.	If they cannot exercise self-control, let them marry someone else.
My boyfriend snores and I have the most terrible time sleeping!	I have the most terrible time sleeping, because my boyfriend snores!	My male friend snores and I have the most awful time sleeping!	My boyfriend snores and I have a horrible time sleeping.	My boyfriend snores and I have a terrible time sleeping.
May be u think not but Yes!!!	You may not think so, but yes!	Maybe you do not think so, but yes!	You may not think so, but the answer is yes.	Maybe you believe it is a no, but it is a yes.
WE HAVE NO ROOM FOR SCREWED UP ANIMALS LIKE THIS IN OUR SOCIETY.	We have no room for messed up individuals like this in our society.	We do not have room for messed up animals like this in our society.	We have no room in our society for crazy monsters like this.	We have no room for violent people like this in our society.
The best way and easiest way is to fly or drive to Las Vegas and get married there.	The best and easiest way is to fly, or drive, to Las Vegas, and get married there.	The best way, and the easiest way, is to fly or drive to Las Vegas and get married there.	The best and easiest way is to fly or drive to Las Vegas and get married there.	The best and easiest way is to fly or drive to Las Vegas and get married.
his answer is good enough for me...	His answer is good enough for me.	His answer works for me.	I believe his answer is good enough for me.	His answer is good enough for me.
no single man can give you what you really want.	No single man can give you what you want.	No man can give you what you want.	No man gave give you everything you want.	No, single men can give you what you really want.
if he doesn't start acting right, then leave him.	Leave him if he does not start acting right.	Leave him if he misbehaves.	If he does not act right, then leave him.	If he does not start acting right, then leave him.
if yor hott too show him your boobies	If you are attractive you can show him your breasts.	If you are also very attractive you should show him your breasts.	If you're attractive, why not?	Show him some cleavage.
a lot of guys like that - just looking for sex.	A lot of men are like that and are just looking for sex.	There are a lot of males who are like that, only looking for sex.	Many men are similar to that, searching for sex.	A decent amount of men just want sex.
(i mess up alot at times ) but she don't forget.	(I make a lot of mistakes), but she does not forget.	I mess up a lot at times and she does not forget.	I mess up often. She never forgets.	She does not forget my mistakes.
WAIT FOR HIM TO ASK U OUT UNLESS UR REAL DESPRETE	Unless you are desperate, wait for him to ask you out.	Unless you are very desperate wait for him to ask you out.	Await for him to ask you out. Unless you're very desperate.	If you are desperate, then ask him out, if not, then wait.
u are asking do u like me	Are you asking if I like you?	You are asking do you like me?	Are you asking if I like you?	Are you asking if I like you?
Whatever  you decide, make it completly YOURS!	Make sure it is your decision.	Whatever you decide, you make it completely yours.	Make sure that your decision is your own.	Whatever you decide, make it completely yours!
her parents?u can't fix it... her friends?maybe u can talk to them nicely...but, pls specify , why?	Can you get someone to help her- her parents or friends?	Her parents? You cannot fix it. Her friends? Perhaps you can speak to them nicely, but please specify as to why?	You can't fix the relationship with her parents, but you may be able to fix the relationship with her friends. Why do you ask?	You cannot fix it with her parents. You might be able to sweet talk her friends. But please specify, why?
How drunk is this girl getting?	How intoxicated what she?	How intoxicated will this girl be?	How inebriated is this woman going to get?	How intoxicated is she?
gals luv guys with positive self image.	Women love men who are self confident.	Women love men with a positive self-image.	Men love women with a positive self-image.	Women are attracted to confident men.
am doing this just for the points lol	I am doing this for some points.	I am only doing this for the points.	I am doing this just for the points.	I am only doing this so that I will receive points.
if ya'll don't know anyting about each other u can't connect.	If you don't know each other well, then there is no way you would connect.	If you do not know anything about one another you will not be able to connect.	If you two do not know anything about each other then you cannot connect.	If you two do not know anything about each other, you will be unable to connect.
If you do... then i would say it was a real and worth realtionship  :)    Good luck	I would say that is was real, and is worth having a relationship. Good luck to you!	If you do, then I would say that it is real and worth a relationship; I wish you luck.	If you do, then I would say that it was a real relationship and completely worth it.  Good luck.	If you truly do, I would say that is was a real relationship. Best of luck to you.
but really if you're used to it and you kinda like it, go with it.	But if you are used to it and you enjoy it, then go along with it.	If you are used to it and you sort of like it, go forward with it.	However, if you are used to it and enjoy it somewhat, go along with it.	But really. If you are used to it, and you kind of like it, then go with it.
cause it's buy one take one.	Because it is buy one, take one.	It's buy one take one.	It is because it is buy one, take one.	Because it is buy one, take one.
AND LAST BUT NOT LEAST--- does he always just happen to be staring...?	And lastly, does he always happen to be staring?	And last but not lease, does he always just happen to be staring?	Last but not least, does he always happen to be staring?	And, last but not least, does he always just happen to be staring?
It sounds like a con, but i'm telling you, chicks dig it.	It sounds false, but I swear, women enjoy it.	It sounds like a con, but I am telling you, women like it.	It sounds as though it might be illegitimate, however I can confirm that women enjoy it.	It sounds like a con, but I am telling you that women enjoy it.
you just have met the dumb ones out there that think skinny is better.	You have the unintelligent ones out there that think skinny is better.	You have met unintelligent women that think being skinny is better.	You have only met the foolish ones who believe thin is better.	You've only met men with a specific preference.
However, i always believed in the fact there's a huge different between HAVING SEX and MAKING LOVE.	However, I always believed the fact there is a huge difference between having sex and making love.	I believe there is a difference between having sex and making love.	"In my opinion, there is a large difference between ""having intercourse"" and ""making love."""	I have always believed that there is a difference between intercourse, and intimate relations.
You just have to make yourself walk away.	You have to make yourself walk away.	You have to force yourself to walk away.	You simply must force yourself to leave.	You have to distance yourself.
in my case i think 80%	In my case, I think around 80%.	I think it is around 80%.	In my situation, probably 80%.	In my case I think it is eighty percent.
leaning in and giving me a soft kiss just on the forehead.	I like it when they lean in, and give me a soft kiss on the forehead.	Leaning in and giving me a soft kiss on the forehead.	Lean in and give me a soft kiss just on my forehead.	Leaning towards me and kissing me gently on only the forehead.
I can't see my life without my husband.	I can not see life without my husband.	I cannot picture my life without my husband.	I cannot see my life without my husband.	I cannot imagine my life without my husband.
I do....much prettier and smooth as silk!	It is prettier and smooth as silk.	I do. It is much more pretty and smooth as silk!	I do think that it is much more attractive and smooth as silk.	I do. It is much more attractive and as smooth as silk.
:) Although, flowers are really nice even if they don't last.	Flowers are nice, even if the do not last long.	However, flowers are really nice even if they do not last.	Flowers are really pleasurable, even is they do not last.	However, flowers are very nice even if they are not lasting.
it sounds like he is having too much fun while you are away.	It is sounding like he is having too much fun while you are away.	It sounds like he is enjoying himself too much while you are away.	Is sounds like he may be having too much excitement while you are away.	It seems that he is enjoying him self overly much while you are away.
WHY don't you just leave the girl alone?	Why do you not simply leave the girl alone?	Why do you not just leave that girl alone?	Why don't you just leave the girl alone?	What's the explanation for one's inability to pester the young woman?
Maybe you should try dating girls if guys offend you so.	Maybe you should try dating girls, if guys offend you so much.	Perhaps you should try dating girls if you are so offended by boys.	Perhaps you should try dating girls if guys offend you.	Perhaps you should attempt to pursue young women, given the tendency by men to be offensive.
i also have not a single girl friend .	I also do not have a single girlfriend.	I also do not have one girlfriend.	I do not have a single girl friend.	In addition, I am in possession of no girlfriends whatsoever.
Just remeber,     s go for guys who are themselves and ONLY themselves!	Just remember: go for men who are themselves, and only  themselves!	Just remember to pursue men who are themselves and do no act like someone else.	Just remember, go for guys that are themselves and only themselves!	"Do not forget, ""s"" is attracted to men who present their true selves to the world, and no one else!"
they feel that they are better than womans but there wrong	They feel that they are better than women, but they are wrong.	They feel as if they are better than women, but they are incorrect.	They feel that they are better than women but they are wrong.	Their opinion is they've exceeded the skill level of females, however, they're inorrect.
That doesn't mean you should let them in.	That does not mean that you should let them in.	This does not, however, mean that you should admit them.	That does not meant that you should let them in.	That fact does not mean that you should let them in your circle.
It's always in the back of my mind.	It is always in the back of your mind.	It is always in the back of my mind.	It is always in the back of my mind.	That thought is always in the back of my mind.
does she have other friends to gab with on the fone?	her friend to talk with her on the phone?	Does she have other friends with whom she can talk on the telephone?	Does she have other friends she can talk with on the telephone?	Does she have other friends to talk with on the phone?
Getting married and getting child can wait but studies can't.	Getting married and having children can wait, our studies cannot.	Getting married and having children can be postponed, but your studies cannot be.	Getting married and having a child can wait, but studies can not.	Getting married and having children can wait, but school cannot wait.
But you need to do this a few times.	You need to repeat this a few times.	You must, however, do this several times.	However, you will need to do this a few times.	You need to do this a few times to get comfortable.
most teen boyz prefer girls that like sex.	The majority of males prefer females that enjoy sex.	A lot of teen boys prefer girls that like sex.	Most teen-aged boys prefer teen girls like enjoy fornication.	Most teen boys prefer girls that like sex.
Don't look back and enjoy the friends you have.	Don't look back. Enjoy the acquaintances you currently have.	Enjoy the friends you have and do not look back.	Enjoy the friends that you have and do not look back.	Don't look back and enjoy the friends you have.
NO GOOD OR BAD IS YOUR PERSONAL BELIEF ON SOMETHING.	No greater good, nor bad is your own personal belief.	Your personal belief is not good or bad.	What is your personal belief on this matter?	If its your personal belief in something its not good or bad.
and i dont know what i should do.	I'm unsure concerning what I should do.	I do not know what I should do.	I do not know what I should do.	I don't know what I should do.
yes it is a sick habit	Agreed, it is an unhealthy behavior.	That is disgusting.	It is a bad habit.	Yes, it is a stupid habit.
wait till you get 25. you would not loose your charm by then.	Delay doing so until you reach age 25. Your appeal will not diminish in such time.	You will not lose your charm at twenty five years of age.	You will not loose your charm by 25.	Wait until you turn 25 because you will not lose your charm by then.
My bff hates my b/f and wishes for me to break up w/ him but I won't.	My eternally close friend despises my partner and hopes for the dissolution of our relationship, but it will not occur.	My best friend wants me to break up with my boyfriend.	My best friend does not like my boyfriend and wants me to break up with him.	My best friend dislikes my boyfriend and wishes that I would break up with him, but I will not.
RELAX AND BE REAL THAT IS WHAT WE LIKE.	Be authentic and restful. Such behavior is that which we enjoy.	Just relax and be cool.	We like it when you relax.	Relax and be yourself because that is what we like.
i dont think so, maybe they should try taking our last names	They should try taking our last names.	I don't think so. Maybe they should try taking our last names.	I do not believe so. Perhaps, they should try taking our last names.	I do not think so. Perhaps they should try our last names.
You both should pick either his or yours once you have kids.	Once you have children, you will need to decide on a last name.	Both of you should pick either his or yours once you have kids.	You both should pick either his or yours, once you have children.	You should both pick either his or yours when you have children.
Of course HE wants to go on.	He wants to continue.	Of course he wants to go on.	Of course, he wants to go on.	Of course he wants to continue.
So I guess I pick domestic goddess.	I pick the domestic goddess.	So I guess my pick is domestic goddess.	So, I suppose I pick domestic goddess.	I guess I picked a domestic goddess.
Ask her out after class again.	Ask her for another date after claess.	After class, ask her out again.	Ask her out on a date after school.	Try asking her out after class.
and people life is to short live it to the fulliest and have faith	Life is too short, so live it to the fullest and have faith.	People, life is too short! Live it to the fullest, and have faith!	Life is too short. Live life to the fullest, and have faith.	Live life to the fullest and have faith.
I am man and I too feel so.... because I too am !!!	As a man, I feel the same way because of who I am.	I am a man, and I feel this as well, because I am as well!	I am man. I feel so as well.	I am a man so I also have feelings.
IF YOU LIKE HIM THAT MUCH,CALL HIM.	Call him if you feel that level of attraction to him.	If you like him that much, then phone him!	If you are attracted to him that much, call him.	Give him a call.
start with a basic everyday question and go from there :)	If you start with a basic question, you can go from there.	Start with a simple common question and proceed from that point.	Start with a simple question and move on from there.	Start with a basic, everyday question and go from there.
tell more ppl (my bor did)	Did you tell more people?	Tell more people, as my brother did.	You should tell more people; My boy did.	You should tell more people.
all my friends want to do is makeout!	My friend want to kiss their boyfriends.	All my friends would like to do is engage in heavy kissing.	All that my friends want to do is to kiss all the time.	All that my friends want to do is conjugate.
also actual kissing and asking if your a good kisser...	You can ask if you are a good kisser.	Additionally, engaging in kissing and inquiring as to your kissing abilities.	As well as asking if you are a good kisser and actually kissing.	Actual kissing and asking if you are a desirable kisser.
we will not regret it.at ur service anytime.	I am at your service anytime, we will not regret it.	We will not regret it. We are happy to help any time.	I am at your service anytime and we will not regret it.	We will not regret being at your service anytime.
u need to reput it in add it back just like first time	You need to put it in again and add it back, just like the first time.	You need to add it back like you did the first time.	You need to replace it. Add it back in just as it was the first time.	You need to replace it, just add it back in, the same way you did the first time.
You can share this with ur mom or dad.	You can share this with your mom or dad.	You can share this with your mom or dad.	You can share this with your mother or father.	You can share this with your mother and father.
And don't fall for the alcoholic only on weekends line that the guy above is giving.	"And do not fall for the ""alcoholic only on weekends"" line that the guy is giving you."	Do not fall for the alcoholic, only on the weekends line is a sign.	"And do not believe the ""alcoholic only on the weekends"" excuse that the previous man is attempting to use."	"Do not fall for the, ""Alcoholic only on the weekends,"" line that guy is giving you."
you sorta stuck yourself out thier to get hurt, unless you know him fairly well.	You sort of put yourself out there to get hurt, unless you know him fairly well.	You have stuck yourself out there to get hurt, unless you know him fairly well.	You have exposed yourself to rejection, unless you are fairly well acquainted with him.	Unless you know him fairly well, you are stinking yourself out there to get hurt.
I prefer A & B cups, myself.	Personally, I prefer A and B cups.	I prefer A and B cups, myself.	I prefer A and B cups, personally.	A & B cups are preferable.
be her friend first then see where it goes	Be her friend first, then observe where it goes.	Be her friend first and then see where that leads.	Become her friend first and then see where that leads.	Start a friendship first, then let the relationship develop.
dont even listen to what people not just guys say,  watch how they act.	Do not even listen to what people, not merely males, state, but observe how they act.	Do not even listen to what people (not only men) say, observe how they behave.	Do not even listen to what any person says, watch the way that they act.	Don't listen to what people, (not just men), say; watch how they act.
do u fell that way ?	Do you feel in that manner?	Do you feel that way?	Do you feel that way?	Do you feel the same?
but if a guy asks u dont be afraid to say NO.	Alas, if a male inquires of you, do not be frightened to state negatively.	However, if a man asks you, do not be afraid to say no.	However if a boy asks you, do not be afraid to tell him no.	However, if a man asks you, do not be afraid to reject him.
Obviously she don't want you if you know she likes the other boy!	Obviously, she does not desire you if you know she is partial towards the other male.	Obviously, she does not want to be with you if you know that she is interested in another boy.	Obviously she does not want you if you are aware that she likes the other boy.	Obviously, she is not interested in you, if you know she is interested in the other boy.
There are lots of things that make a woman not like sex.	There are lots of things that make a woman dislike sexual intercourse.	There are many things that deter women from sex.	There are plenty of things that make a woman not like sex.	There are many factors that cause a woman to dislike intercourse.
Not all guys get bored and move on.	Not all men get bored and move on.	Not all gentlemen break up with their woman.	Not all guys get apathetic and move on.	Not all men become bored and move on.
BUT --  There's no better person to marry someday than your best friend!	But there is no better person to marry someday than your best friend!	Your best friend is a good choice to marry in nobody else works out.	But there is no better person to marry someday than your best friend.	But there is no better person to marry than your best friend.
depending on what yo uare looking for, freindship only, like.	Depending on what you are looking for, the relationship may be friendship only.	Are you looking for friendship?	It depends on what you are looking for.	It depends on what you are searching for, as in friendship only, etc.
i did this with my current boyfriend.	I did this with my current beau.	I do this with my current boyfriend.	I did this with my current boyfriend.	I behaved as such in the company of my present romantic partner.
But it doesn't mean you cannot love another.	It does not mean that you cannot love another.	It does not mean you can not love another.	However, it does not mean you cannot love another.	However, it's not defined as you both being unable to have affection for one another.
just divorce that guy... he has no honour and he dont love you.	In my opinion, you should divorce that man, he has no honor and he does not love you.	You need to divorce the guy, he has no honor and does not love you.	Simply divorce him, since he has no honor and does not love you.	Simply dissolve the marriage. He possesses no valor and he has no feelings for you.
basicaly men just want to have girlfriend for free sex!!!	Basically, men just want a companion for unfettered copulation.	Men want to have a girlfriend for the free sex.	Basically, men are only interested in romantic relationships for the physical aspects.	In essence, males simply desire a female romantic partner in order to have sexual relations!
if nothing work ... u have to ask him for it again  :-)	You will have to ask him for it again if nothing else works.	If nothing works, you have to ask him for it again.	If nothing works, you should ask him for it again.	Should no action prevail, you must request it of him once more.
