Like I said; he already knows that you like him, so just take a deep breathe and ask him.	Like I said, he already knows that you like him, so just take a deep breath, and ask him.	As I said, he knows you are interested in him, so take a deep breath and ask him.	He knows that you like him, so just ask him on a date.	As I said, he already knows you like him, so just take a deep breath and ask him.
Maybe you and I can get together sometime & we'll find love with one another.	Maybe you and I can gt together sometime.  Perhaps even find love in one another.	Perhaps you and I can get together sometime; we may find love.	Maybe we can go on a date and we will find love with eachother.	Perhaps you and I can get together some time and we will fall in love with each other.
I would be, but I'm just married !	I would be, but I am married.	I would be, however I just got married.	I am married now.	I would be, but I just got married!
Play the field a bit now.	Play the field a little bit.	Explore your options for a while.	You need to date some new people.	Play the field for a bit right now.
As everyone said... dont get married so early.	As everyone said, don't get married so early.	Do not get married so early in the relationship.	As everyone has told you, do not get married too early.	I agree with everyone else, don't marry too early.
just want to know HAVE YOU BEEN TO THE DOC YET !	I just want to know, have you been to the doctor yet?	Have you seen a doctor yet?	I want to know if you have been to the doctor yet.	Have you been to the doctor yet?
Pay Attention to what the other person says!	Pay attention to what the other person says.	You should pay attention to that the other person is saying.	Pay attention to what the other person says.	Pay attention to what everyone else is saying.
Just Talk your spouse about this	Simply communicate with your spouse about this.	Simply discuss the subject with your spouse.	Talk to your spouce about this.	Just talk to your spouse about this.
if you are into sixth graders you are obviously young.	If you are interested in sixth graders, you are obviously young.	Given your attraction to sixth grade children, you're apparently youthful.	You are young if you are interested in sixth graders.	If you are into sixth graders you are obviously young.
i was thinking about a medium pink color, but with what??	I was considering a medium pink color, but paired with what?	I've been contemplating a mid-level pink hue, however, what should it be alongside?	What color would go well with a medium pink color?	I was thinking about picking a medium pink color, but what should it go with?
Ask if they wanna go somewhere with you.	Ask them if they would like to go somewhere with you.	Inquire of their desire to travel to a location accompanied by you.	Ask them if they want to go someplace with you.	Ask if they want to go somewhere with you.
-a trip to amusement park such as roller coaster or even theatrical museum.	I would like a trip to an amusement park, or a museum.	A visit to an amusement park with a roller coaster. Perhaps a theatrical museum.	A trip to an amusement park including roller coasters or perhaps a theatrical museum.	A trip to a amusement park such as a roller coaster or even a theatrical museum are fun.
Or do guys really do prefer bigger women?	Do goys prefer bigger women?	Do men truly prefer bigger women?	Or do you fellows prefer larger women?	Do men truly prefer bigger women?
problem is i really like him.	I like him.	My concern is that I'm deeply attracted to him.	The problem is that I care for him very much.	The problem is that I truly like him.
so id say, they do work out, just not a lot of the times...hope this helps...	It can work out, just not all the time.	I believe they do work out, although not often. I hope I helped.	Therefore I would say that they do succeed but not frequently. I hope this is helpful.	I would say they do work out, not a of the times, but I hope this helps.
SHould I dump him because of his mother	Should I break up with him because of his mother?	Should I break up with him because of his mother?	Should I break up with him because of his mother?	Should I break up with him because of his mother?
I did this before (accidentally) and my friend was mad that I deleted him!	I accidentally did this before and my friend was mad that I deleted him!	I accidentally did this before and my friend was angry that I had deleted him.	I accidentally did this in the past and my friend was angry that I deleted him.	I did it before, accidentally, and my friend was mad that I deleted him.
I dont think I mind either way.	I do not think I mind either way.	I do not mind either way.	I do not think I mind either way.	I do not believe I mind, either way.
but thats her way... you could try it that way or you could just keep your eyes open...	But that is her way. You could try it that way or you could just keep your eyes open.	You could try it her way or you could try keeping your eyes open.	But that is her way. You could attempt it that way or you could remain watchful.	That is her way. You could try it that way or you could keep your eyes open.
there are some that do, but you should be able to tel.	There are some that do but you should be able to tell.	You should be able to tell the few that will.	There are some that do, but you should be able to notice.	Some do that, but you should be able to tell.
r u talking about ur avatar?	Are you referring to your avatar?	Are you talking about your avatar?	Are you talking about your avatar?	Are you talking about your avatar?
I dont ever remember giving a girl a Cristmas gift unless I liked her.	I do not recall ever giving a girl a Christmas gift unless I cared for her.	I dont remember giving a woman a Christmas gift unless I liked her.	I do not ever remember giving a woman a Christmas gift, unless I liked her.	I do not remember giving a woman a Christmas gift, unless I liked her.
I don't know what to do.	I do not know what to do.	I do not know what to do.	I do not know what to do.	I do not know what to do.
Try to be your self and don't show off	Attempt to be authentic and do not act ostentatiously.	Try to be yourself and do not try to impress anyone.	Try to be yourself, and not show off.	Try to be yourself and do not show off.
so just take it day by day-step by step.think of how he lost a good thing.	Simply proceed one step at a time. Consider how he lost a something positive.	Just take it day by day and think of how he lost a good thing.	So, just take id daily and step-by-step. Think of how he lost a good thing.	Just take it day-by-day and step-by step to figure out how he lost a good thing.
Dang it, if only every man knew What Women Want the world would be a much happier place!!!	"If only every man would watch ""What Women Want"" the would be a much happier place!"	Darn it, if only every man had knowledge of what women want, the world would be a much better place!	It is a shame that if only every man knew what women wanted, the world would be a much happier place.	The world would be happier if men knew what women want.
compliments, honesty and make it about her.	Compliments, honesty, and focus on her.	Compliments, be honest and focus on her.	Give her compliments, honesty, and make it about her.	Make it an honest compliment about her.
i think hse will crash him!	I think he will crush him!	I believe she will wreck him!	I believe that she will hurt him.	I think she will hurt him.
IT JUST MEANS THAT SHE IS REALLY INTERESTED IN THE GUY.	It means she is interested in him.	It just means that she seems to be really interested in the man.	It only means that she is very interested in the man.	It means she is interested in the guy.
please do.. im thinking  you would get slapped mid-reach,or kicked in the groin.	Please try. I think you will be slapped mid-reach, or kicked in the groin.	Please do, I am thinking you would be slapped as you reach out or perhaps kicked in the groin.	Please do, but I believe that you would get slapped or kicked in the groin while you are in mid-reach.	I am thinking you might get harmed.
Only now she and I are both divorced.	She and I are both divorced.	Except now we are both divorced.	She and I are only just now both divorced.	We are now only just divorced.
if he/she want to see you picture rightaway it sex!	Does she want to see a picture of you right away?	If he/she wants to see your photograph immediately, then it is sex.	If the person wants to see your picture right away, it is about sex.	If the suggest a salacious photo, they would like to have intercourse.
hey it's better than her givin u a fake # to call lol!	It is better then giving her a fake number.	It is better than her giving you a false phone number to call.	It is better than if you giver her a fake telephone number to call.	At least she didn't give you a fake number.
tell her to move to MASS.............	She need to move to Massachusetts.	Tell her to move to Massachussetts.	Ask her to move to Massachusetts.	Tell her to move to Massachusetts.
if you feel this strongly about it then maybe you shouldn't get married.	If you feel so strongly about it, perhaps you should not get married.	If you feel that strongly about it, then perhaps you should not get married.	If you feel this strongly about it, then maybe you should not get married.	You should not get married if you feel this strongly about it.
The pictures I've seen...I would say Maui or the Bahamas.	From the photographs I have seen, I would say Maui or the Bahamas.	From the pictures that I have seen, I would say Maui or the Bahamas.	Based on the pictures I have seen, I would say Maui or the Bahamas.	I would pick Maui or the Bahamas.
the guy i like is mad at me.	The man I like is angry with me.	The man I like is upset with me.	The man I am attracted to is angry with me.	The guy that I like is mad at me.
You're 13 don't even worry about it...	You are 13, do not concern yourself with it.	You are 13, do not even worry about it.	You are thirteen-years-old, so do not even worry about it.	Do not worry, you are only 13.
That way you dont have to worry about you calling him too much!	Do not worry about calling him too much.	That way you do not have to worry about phoning him too much!	That way you do not have to worry about calling him too much.	Try this which will result in you not worrying about the appropriate amount of calls to him.
I am a guy and let me tell you, we love to chase!	I am a guy and we like to chase women.	I am a man, and let me tell you, we love to chase!	"I am a man, and let me tell you, ""We love to chase."""	As a guy, I can say, we men love to chase women.
Thanks for the pep in advance!	Thank you in advance.	Thank you in advance for the support!	In advance, thank you for the pep.	Thanks for the talk.
we always seem to push the ones taht we love away.	We always seems to push away the ones that we love.	We seem to always push away the ones who we love.	We always seem to push away the ones that we love.	We tend to push away the ones that we love.
they think that they can control other peoples lives when thye cant	They think that they can control other people's lives.	The believe that they can control others lives when they cannot.	They think that they can control the lives of others when they cannot.	They believe that they can control the lives of others when they cannot.
thats weird but maybe idk ill talk to my friend by his locker.	That is odd, but perhaps, I will talk to my friend by his locker.	That is weird, but perhaps I will talk to my friend near his locker.	That is strange but perhaps. I do not know. I will speak to my friend later next to his locker.	That is strange but I do not know. I will talk with my friend by his locker.
I don't know....how would you like something crammed up your butt!!	I am not sure, how would you like to have an article forced into your derriere.	I do not know; How would you feel if something were in your anus?	I do not know. Would you enjoy having an item inserted forcefully in your rectum?	I do not know. How would you like to have something pushed up your anus?
If a guy cares he calls.	If a man cares about you, then he will call.	If a man cares he will call.	If the man cares then he calls.	If a man cares, then he calls.
what special gift can i give my would be brother in law for his birthday?	What is a special gift that I may give my future brother in law on his birthday?	What special gift can I give my would-be brother-in-law for his birthday?	What gift can I give my future brother in law for his birthday?	What is a special gift I can give to my brother-in-law on his birthday?
he probably doesnt want to either.	It is probable he does not want to either.	He likely does not want to either.	He does not want to, either.	He probably isn't interested either.
hold her hands, look to her eyes and say it, but only say it if you really love her.	Hold on to her hands, gaze in her eyes and say it, however, only say this is you really love her.	Hold her hands, look into her eyes, and say it; but only say it if you really love her.	You can say it, but only if you mean it. Also hold her hands, and look into her eyes.	Hold her hands, look in to her eyes, and tell her everything you've wanted to say.
Some guys do...and some guys don't.	Some men do, others do not.	Some guys do, and some guys do not.	Some guys do; and some do not.	Some men do, and some men do not.
hey i really want to know so please help me out!!	I would really like to know, if you could please help me.	Can you help me get to know her?	I would very much like to know so please assist me.	I would very much like to know, so please help me.
The timing just wasnt right for it with the old guy...you'll see!	The timing with the older man was not right, you will see.	The timing was not right to date the older guy.	The timing simply was not right for it with the elderly man. You will see.	The timing was not right with the former man, you will see.
Generally kind and my fifth: I'll just be dissapointed if she's stupid.	Generally kind and I will be disappointed if she is stupid.	I want a girl who is kind, and intelligent.	Generally kind. And for my fifth, I will simply be disappointed if she is unintelligent.	Generally kind and my fifth. I will only be disappointed if she is unintelligent.
its one of the gifts we can always give ourselves.	It is one of the gifts that we are always able to give ourselves.	Determination is one of the gifts we can give ourselves.	It is one of the gifts we can always give ourselves.	It is one of the presents which we can always give ourselves.
I do not believe trust has to be earned, because how is that even possible.	I do not believe trust has to be earned, because how is that even possible?	I don't believe you need to earn someone's trust, how is that possible?	I do not believe that you have to earn someone trust. I do not see how that is possible.	I do not believe that trust needs to be earned because how is that even possible to do?
lol so if thats u u deff need to stop that is FONKY!!	So, if that is you, you sincerely need to stop as that is most unorthodox.	So if that is you, you need to stop, it is too bizarre.	If that describes you, then you certainly need to stop. That is strange.	If that is you, then you definitely need to stop because it is nasty.
DON'T LET HER RULE YOUR LIFE, SHE WILL JUST HAVE TO LEARN TO DEAL WITH IT.	Do not allow her to dominate your life for she will simply have to learn to deal with it.	Don't let her control your life, she will have to learn to live with it.	Do not let her control you. She needs to learn to deal with it.	Do not let her rule your life, she will need to learn how to cope with it.
I have yahoo email and that works for me.	I have Yahoo email, and that works for me.	I have a Yahoo account, and that is fine with me.	I have a yahoo e-mail address and that is sufficient for me.	I have Yahoo email and that works fine for me.
I wouldn't worry too much about it.	I would suggest not worrying about it overmuch.	I wouldn't worry too much about it.	Do not concern yourself with it.	I would not worry too much about that.
Oh yes, the trick ass hoe's never had a chance.	Yes, the promiscuous women never had a chance.	Oh yes, the trick that person never had a chance.	They never had a chance.	Yes, that trickster has never had a chance.
when you can fart in front of the one your dating	When you can pass gas in front of the one with whom you are in a relationship.	When you can fart in front of the one you are dating.	You know you were meant to be together if you can break wind in front of each other.	It is a good sign when you can fart in front of the person you are dating.
depends on how old they are.	It depends on their age.	Depends on how old they are.	How old are they?	That depends on the person's age.
And any guy who sas he woul is prolly not being entirely honest with himself.	Any man that says that he would, is probably not being entirely honest with himself.	Any man that states he would is more than likely not being entirely honest with himself.	And any man who says he would is probably not being entirely honest with himself.	Any man who says he would, is likely not being entirely honest with himself.
If you flirt with him, the challange is not there.	If you philander him, then the challnge is not there.	If you bat your eyes at him, the challenge is nonexistent.	If you flirt with him, there is no challenge.	If you flirt with him, the challenge is not there.
If you need your x emotionally - then ya got some troubles.	If you need you ex emotionally, then you are going to have some troubles.	If you need your ex emotionally, then you do have some problems.	If you need your ex emotionally, then you have some troubles ahead.	If you need your ex emotionally, then you may have some issues.
20 to 32...she doesn't have to be younger than you.	She does not have to be younger than you, 20-32 will do.	Twenty to thirty-two, she does not have to be younger than you.	Twenty to thirty-two is fine and she does not have to be younger than you.	She should be 20 to 32. She does not have to be younger than you.
my be she don't love  you but  try to use your  brean not  your haerd	Try to use your brain and not your manhood, maybe she does not love you.	Perhaps she doesn't love you, but attempt to use your brain and not your head.	Maybe she does not love you but try using your brain and not your heart.	Maybe she does not love you, but try to use your brain and not your heart.
If you want your girlfriend forever..........then just don't let her know that you want her forever, simple.	Do not let your girlfriend know that you want her forever.	If you want to spend forever with her, do not tell her.	If you want your girlfriend forever, do not let her know that you want her forever.	Do not let her know that want to be with her forever and you probably stand a better chance of that being the way that it is.
There are tons of cheap ideas out there, just find what you like and work with it!	There are plenty of cheap ides out there; you just need to find what you like and work at it.	There are plenty of inexpensive ideas. Find what you are interested in and work from there.	Tons of cheap ideas are out there, find what you like and work with it.	There a lot of inexpensive ideas out there, you need to find what you like and work with it.
And if you are worried about doing it - performance wise - DONT.	If you are skeptical about the performance piece of it, then do not do it.	If you are worried about your performance, do not.	If you are worried about doing it, performance wise, do not do it.	If you are worried about it performance wise, you should not.
find a nother girl and if that dosent work move back	Try another woman and if it fails, then move back.	Find another woman. If that does not work, move back.	Find another woman and if it does not work out, move back.	Find another girl if that does not work, move back
Most often (not always) that will be guys around your age, give ot take.	Most often that will be guys around your age.	Most often (although not always), there will be men who are approximately your age.	Most often (not every time) that will be boys around  your age, give or take.	Almost without exception (not constantly) those are men similar in age to yourself, more or less.
if u you act like dat all da time she might think u desperate.	If you act like that all the time she might think you are desperate.	If you act in that manner at all times, she might find you desperate.	If you act like that all of the time, she may believe that you are desperate.	If your behavior is always as it is now, she may come to believe you're in a state of desperation.
not everyone on here is in school.	Not everyone on here is in school.	Not everyone here is in school.	Not every person here is in school.	Not every participant present is attending educational courses.
tell him what you really want...that's what they tell me but never got to do...speak up...	Tell him what you really want; that is what they tell me even though they never got to do that, so speak up.	Communicate to him what you really want and speak up; that is what they tell me but I never got to do.	Tell him what you really desire, that is what I was told, but I never got to do it, speak up.	Advise him of your genuine desires. That's the information relayed, but an action not attempted. Make comments.
should i  make the first move or should i wait for him to make the first move ?	Should I make the first move or should I wait for him to make the first move?	Should I make the first move or wait for him to do so?	Should I attempt the first interaction or should I wait for him to make his attempt first?	Shall I take the initial action or shall I bide my time until he takes the initial action?
What a typical double standard you have set up!!	What a typical double standard you have.	You have set up a double standard.	What a typical double-standard you have set up!	You have set up a double standard.
after a while you dont even see the color.	After a while you don't even see the color.	After some time, you will not see the color.	After a while, you do not even see the color.	After a while, you do not see the color.
:) I haven't tried it yet, but I am still trying to get up the nerve....	I haven't tried it yet but I am still trying to get up the nerve.	I am still trying to work up my nerves to try that out.	I have not tried it yet, but I am still trying to wok up the nerve to.	I am trying to get the nerve to ask her on a date.
If you two are serious then asking her that question shouldn't bother her.	If you two are serious, asking her that question shouldn't bother her.	If it is serious between the two of you, then that question should not bother her.	Asking her that question should not bother her, if you two are in a serious relationship.	If you two are serious, then if you ask her that question, if should not bother her.
sak her out what's up with that?	Ask her out, what's up with that?	What is up with her?	"Ask her, ""what is up with that?"""	Why do you want to ask her out?
How about...Would you like to go out with me sometime?	Would you like to go out with me sometime?	"Try using the phrase, ""would you like to go out with me sometime?"	Maybe ask if they would like to go on a date sometime soon.	Would you like to go on a date with me?
yah look me up if you are ever in florida  lol!!!	Yes, look me up if you are ever in Florida.	If you are in Florida, look me up.	Look me up if you ever decide to visit Florida.	Let me know if you are ever in Flordia.
Those was good times I tells ya.	I tell you, those were good times.	Those were the best of times.	Those were great times.	Those were some wonderful times.
its all about her, and no it shouldnt be something that happends on a first date.	It is all about her. No, it should not be something that happens on a first date.	It is all about her and it should not occur on the first date.	She's concerned only about herself. No, that should not occur on a primary outing.	It is all about her, and that isn't what should happen on a first date.
Do you really want to spend the rest of your life with someone you argue with all the time.	Do you honestly want to spend the rest of your life with someone you argue with all the time?	You have do decide whether you want to spend the rest of your life with someone with whom you constantly argue.	Do you honestly want to spend your life with someone you argue with all the time?	Do you really want to get married to someone you constantly argue with?
If he comes to his senses then great if not SCREW HIM!!	If he comes to his senses, then great, if not, break up with him.	If he comes to his senses, great; if not, you should move on.	If he comes to his senses, great. If not, then leave him.	If he has come to his senses, then that is wonderful.
you are too good for them	You are too good for them.	You deserve more than them.	You are too precious for those people.	You are too good for them.
Jump him because she likes him??	Have sex with him because she likes him?	She likes him so you are going to jump him?	Attack him because he is interested in someone else?	Get the upper hand because she like him.
depending on the age, cds or dvds.	It depends on the age, but CDs or DVDs.	Either a CD or a DVD will be appropriate.	It depends on the age, do they use CDs or DVDs?	Depending on the age, Compact Disc or Digital Video Discs.
20 YEARS DOWN THE ROAD THAT IS ALL YOU CAN BE SO START FROM THE BEGINNING	Twenty years down the road, that is all you can be. So, start from the beginning.	Star fresh and be all that you can.	You are twenty years old, you can start all over again.	Start from the beginning and then work your way to 20 years down the road.
