i would like to have some fun with u that's why i answered this stupid question	I would enjoy having some fun with you, that is why I answered this silly question.	I would enjoy having some fun with you, that is why I answered this ridiculous question.	I would like to have some fun with you. That is why I answered this dimwitted question.	I would like to have some fun with you. That is why I answered the question.
try to contact their q&a team..they'll help you through..have a nice day!	You should try to contact their question and answer team and they will help you through it; Have a good day!	Attempt to contact their Q&A Team, they will assist you, have a wonderful day!	Attempt to contact their question and answer team. They will assist you with the process. Enjoy your day!	Try to contact their question and answer team. They will help you through, have a nice day.
Because womens don`t put out often...	Because women do not have sex often.	Because women do not have sexual relations often...	Because women do not yield frequently.	Women are not easy to get into bed.
if he insists, it means he only after sex.	If he insists, then it means that he only wants to have sex.	If he insists it means that he is only after intimacy.	If he insists then it indicates sex is his only goal.	If he insists, it means he is only after sex.
B) Looks definitely matter, anyone saying they don't is probably lying.	Looks definitely matter and anyone who says that they do not is likely lying.	Looks absolutely matter, any person saying that they do not is more than likely fibbing.	Option B: Appearance certainly matters. Anyone who claims otherwise is most likely being dishonest.	It definitely matters. Anyone saying they do not, is likely lying.
Whle MAKING LOVE is like living a fantasy.	Making love is like living a fantasy.	"While ""making love"" seems to be a fantasy."	Making love is similar to living in a fantasy.	While having intercourse is similar to a fantasy.
when you 18 or 20 because when they said something they dont mean it	When you are 18-20, sometimes you say what you do not mean.	When you are 18 or 20 because when they say things they are insincere.	They said something they do not mean.	When you are eighteen or twenty years old, because when they said something, they did not mean it.
when possible, try to make it yourself.	Try to make it yourself, when possible.	When possible, attempt to make it yourself.	Try to make it yourself when possible.	Try to make it yourself whenever possible.
But (there's always a but isn't there?	There is always an exception, correct?	"But (there is always a ""but,"" is there not?)"	There is always something else.	But, because there is always an exception, is there not?
If she is not into you anymore...	She is not that into you anymore.	If she is not interested in you any longer.	She is not into you anymore.	If she is no longer interested in you.
i seriously doubt that you are in love with that many guys.	I seriously doubt that you are in love with that many men.	I sincerely doubt that you are in love with that many men.	I seriously doubt that you are in love with that number of men.	I really doubt that you are in love with all of those men.
on average id say about 45% at first but than one you get to knowthe person maybe 15%	On average, I would say about 45% at first, but then once you get to know the person, perhaps 15%.	I would estimate an average of 45% initially but then, once you become acquainted with the person, perhaps 15%.	On average, I would say that 45% in the beginning, and approximately, 15% once you get to know the person.	On average, I would say about 45 percent at first, but it is perhaps 15 percent once you get to know the person.
Play sports with your guy friends.	You should play sports with your male friends.	Participate in sports with your male friends.	Play sports with you male friends.	Play sports with your male friends.
She will tell you if it's not OK.	She will tell you if it is not alright.	She will inform you if it is not acceptable.	She will tell you if it is not good.	She will tell you if it is not okay with her.
I don't mean, do you think women are sexy and beautiful.	I do not mean, do you believe women are beautiful?	"I did not intend to ask ""Do you think women are sexually attractive and beautiful?"""	"I did not mean, ""Do you think that women are seductive and beautiful?"""	I am not asking whether you think women are sexy and beautiful.
how do i get he to stop nagging me and leave me alone.	How do I get him to stop bothering me and leave me be.	How can I get him to stop pestering me?	How do I get him to stop nagging me and leave me alone?	How do I get him to stop nagging me and leave me alone?
a sex toy, that way you can both enjoy it.	An intimate, adult toy, that way you can both enjoy it.	Buy a toy specifically for intercourse that you both would enjoy.	An intimate toy, so that you can both enjoy it.	Try a sex toy, that way, you both can enjoy it.
men without hair look like little boys to me, and it's not sexy at all.	Men that do not have hair appear as little boys to me, and it is not attractive whatsoever.	Bald men look like children to me, I don't find it attractive.	In my opinion, men without hair look like little boys, and it is not seductive at all.	Men without hari look like itttle boys, it is not attractive to me.
i agree, just kiss him... he'll respond one way or another.	I agree, just kiss him, he will respond either way.	I agree, kiss him, and he will have a response for you.	I agree that should just osculate him, he will respond one way or another.	If you kiss him, her will respong one way or the other.
a good way is to imagine yourself without him/her.	A good way is to try and imagine yourself without him or her.	Something you can o is imagine your life with out him or her.	A good way to try is to imagine yourself without him or her.	Can you imagine yourself without him/her?
here in America it is not so important...	It is not so important here in America.	Here in America, it is not very important...	In America, it's not as important.	Here, in America, it is not so important.
well if it was before you then he wasnt cheating at all... obviously.	Well, if it was prior to his relationship with you, then obviously he was not being unfaithful at all.	Well, if it was prior to you, then he was not cheating at all, obviously.	If it was previously to you, then he hadn't commited adultery.	Well, obviously, if it was before you, then he was not cheating at all.
man how many times I passed up a great oppertunity by worrying about someone saying No......	"Man, how many times have I passed up a great opportunity because I worried about someone saying ""no"" to me?"	How many times I let a great opportunity go from worrying about some person telling me no...	Multiple times I have passed on a great opportunity by concerning myself about someone else.	"I wonder how many times I passed up a great opportunity by worrying that someone would say, ""No."""
Because the white women are taking up all the men!!	Because the white women are taking up all of the men!	Because the white females are taking all of the men!	Caucasian women are appropriating all the men!	The Caucasian women are taking up all the men.
ur self image is also very important.	Your self-image is also very important.	Your reputation is also very important.	Your self image is as well very important.	Also, your self-image is very important.
Have you ever had a PAP smear.	Have you ever had a PAP smear?	Have you ever received a PAP smear?	Have you ever had a pap smear?	Have you had a pap smear?
good god how old are you ?	Good god how old are you?	Wow, how many years of age are you?	How old are you?	How old are you?
but i think they both like me.	But I think they both like me.	But I believe that they both have affection for me.	I believe they both like me.	I think they both like me.
Okay well first thing it sounds as if YOU GUYS ARE ALREADY MARRIED!.	Ok, first thing is that it sounds as if you guys are already married.	Okay, well, first, it sounds as if you two are already married.	Well, the first thing sounds as if you guys are already married.	It sounds like you two are already married.
yes jaime is going to ask rubi out.... but it is not yoru business...	Yes, Jaime is going to ask Rubi out, but it is not your business.	Yes, Jaime is going to ask Rubi to go steady, but it is not your business..	Yes, Jaime is going to ask Rubi to go on a date. But, it is not your business.	Jamie is going to ask Rubi out on a date.
that is a sign, things like that can make it really obvious	That is an indication. Things such as that can cause it to be readily apparent.	That is a sign, conditions like that, can make it really obvious.	That is a sign. Things like that can make it obvious.	That is a signal. Such things can make it very obvious.
u should take the time to get to know both of them equally without goin out with them.	You should take the time to become acquainted with both equally without dating either of them.	You should take the time to get to know both of them, equally, without going out with either of them.	You should take the time to get know both of them equally without going on dates with them.	You should take time to get to know them both equally without going on dates with them.
i'd love to hear logical opinons on this, thanks	I would be very pleased to hear logical opinions on this topic. Thank you.	Thank you, I would love to hear some logical opinions on this matter.	I would love to hear your logical opinion on this, thank you.	I would appreciate logical opinions on this. Thank you.
If you like the guy then go for it.	If you care for the man then proceed.	If you like the man, then go for it.	If you like the man, then go for it.	If you are interested in the man, then attempt it.
Having FUN with guy friends is OK.  1.	Enjoying yourself with male friends is acceptable.	Having fun with male friends is alright.	Having fun with guy friends is okay.	Enjoying yourself with male friends is fine.
So its natural with that guy.	So it is natural with that guy.	So, it is natural with that man.	Therefore it is natural for that man.	So, it is natural with that man.
women take on alot and sometimes they feel like they do it for nothing.	Women take on too much, and sometimes they feel like they do it for nothing.	Women take on a lot, and sometimes they feel like they do it for nothing.	Women accept a lot and sometimes they feel as though they do it for no reason.	Women take on very much and at times, they feel like they do it for no reason.
no, because i'm not married yet	No, because I am not married yet.	No, because I am not married, yet.	No, because I am not yet married.	No, because I am not yet married.
let me know what you think, thanks	Let me know what you think.	Let me know what you think. Thank you.	Tell me your opinion. Thank you.	Let me know what your thoughts are, thank you.
If you are gay BE GAY!!!	If you are a homosexual then be a homosexual.	If you are a homosexual, be yourself.	If you are homosexual, then act like it.	If you are gay then be gay!
good luck and hang in there.	Good luck and do not give up.	Hold on and stay strong and good luck!	Good luck and hang in there.	Good luck and hang tight.
i like older girls so i think this is sick and wrong that they cant go out with her	I like older women so I believe it is strange and wrong that they cannot go on a date with her.	I like older girls, so I believe that it is disturbing and wrong that they can not go out with her.	I like older women so I think it is wrong that they cannot go out with her.	I think it is wrong that they cannot go out with her.
i am just curious to what everyone thinks.	I am merely curious about what everyone thinks.	I am curious about everyone's thoughts.	I am just curious about what everyone thinks.	What does everyone think?
my last bf i met driving round a roundabout in another car!!	I met my previous boyfriend by driving in a roundabout in another car.	My last boyfriend I met while driving around a roundabout in a different car.	I met my last boyfriend driving around a roundabout in another car.	I met my last boyfriend while I was driving in a roundabout.
becuz if you do then your gonna lose your friend over a guy!!!!	You are going to loose your friend over a guy.	If you do, then you are going to loose your friend over a man.	Because, if you do, you will lose your friend over a man.	Because if you do, you are going to lose your friend over a man!
It really was a casual aside when I said it -- I didn't think he would remember.	I did not think he would remember, it was casual when I said it.	I said it casually, I do not think he would remember.	It was truly a casual aside when I said it; I did not think he would remember.	It was really casual with I said it, I did not think he would remember.
are you a country girl or a city girl.	Do you like the country or city?	Are you a country woman or a city woman?	Are you a young woman from a rural environment or from an urban environment?	Are you a country girl or a city girl?
hang out all day together and to top it off touch his feet.	You can be together all day, and touch his feet.	You can try hanging out all day long together and then you can top it off by giving him a foot massage.	Spend all day together and, to top it off, touch his feet.	Spend the day together, and to top it off touch his feet.
im very bored bein single.sittin back watchin other gurlz hava all da fun!	I do not like being single. I watch everyone else have fun.	I am very disinterested with being single and sitting back watching the other women have all of the pleasure.	I am quite bored with being single and observing while other women have all the fun.	I am bored of being single. I can only sit back any watch as other girls have all the fun!
)women are curious about sex with other women, even me!	Women are curious about sex with other women, even myself!	Females have curiousity regarding sex with other females, myself included!	All women are curious about sex, even with other women.	Women, including myself, are curious about sex with other women.
I don't know what you said because I was to lazy to read your typing.	I do not know what you said. I was too lazy to read your response.	I have no idea what your remarks were since my excessive laziness prevented me from reading what you'd typed.	I'm unaware what you stated, because I was too lethargic to read your typing.	I was too lazy to read your typing, so I do not know what it was that you said.
i hate it my self, i love the straight ones	I hate it. I love the straight ones.	I despise it personally. I adore the variety that's straight.	I dislike it myself. I adore the straight items.	I dislike it myself; I love the straight ones.
This is Doc Izzy and I love and adore bigger women!	This is Doctor Izzy speaking.  I love and adore plus-size women!	This is Doc Izzy, and I love big women!	"I am ""Doc Izzy"" and I love and adore larger women."	I am Doctor Izzy. I love and adore larger women.
there are not any words that are going to make it any better.	No words will make the situation better.	There are no words that will make it better.	There are not any words that will make things any better.	There are no words that will make it better.
do it before it is to late	You should take action before it is too late.	Do it before it is too late.	You need to do it before it is too late.	Do it before it is too late.
well to tell u tha truth u learn but u have to actually do it.	To tell the truth, you will learn, but you must experience things.	Well, to tell you truth you will have to do it to learn.	Well, to be honest, you will learn but you need to actually do it.	Honestly, you will learn but you must actually do it.
Nay Pier is a great place or one of the museums....there r alot of great resteraunts of hotels.	Navy Pier and the museums are great to visit.  There are also many great restaurants and hotels.	Navy Pier is a great place, or a museum. There are many great restaruants and hotels.	Navy Pier or one of the museums are great places, and there are a lot of great restaurants in hotels.	Navy Pier is a good place or one of the museums. There are many good restaurants or hotels.
thats a stereotype( not a country girl by the way)And I think Im sexy in my own way.	That is a sterotype, and I am not a country girl. I think I am attractive in my own way.	That is a stereotype. I would like to inform you that I am a rural woman. I think I am sexually attractive in my own way.	That is a cliche (not the farm girl type, I should mention) Also, I believe I am sexually appealing in a manner suiting myself.	I am not a country girl by the way but that is a stereotype and I think I am sexy in my own way.
he wont turn you down .	He will not turn you down.	He will not reject you.	He will most certainly refrain from rejecting your request.	He will not turn you down.
well i hope you read this really well.	I hope you read this well.	I hope that you read this very carefully.	Well, I'm hoping you'll review this information very thoroughly.	Well, I hope you read this very well.
lots of men like thick girls, most of them are black.	Many men prefer curvy women, most of them are African American.	Many men like women who are heavy. Most of them are black.	A large number of males appreciate heavyset women; they are primarily African American.	Lots of men, especially black men, like women who are slightly heavy.
If she's interested she'll call later.	If she is interetsted, she will call you later.	If she is interested then she will telephone you later.	Should she express any interest, she'll phone at a future time.	If she is interested she will call later
No, you won't because you know he has cheating tendancies.	No, you will not because you know he has cheating tendencies.	No, you will not, because you know he has cheating tendencies.	No, you will not since you're cognizant of his inclination to be unfaithful.	No you will not because you know he has a tendency to cheat.
Ask ur self that, if you know what I mean.	Ask yourself that; if you know what I mean.	Ask yourself that, if you know what I mean.	Inquire of yourself regarding the topic at hand, if you comprehend my intention.	As yourself that if you know what I mean.
I find if I try real hard I can see things I know aren't there normally there.	I find that if I try really hard I can see things I know are not there normally.	I find that if I try hard, I can see things I know are not there, that normally is.	I've discovered if I employ a concerted effort, I'm able to visualize a reality that I'm aware is not typically present.	I find if I try really hard, I can see things that I know are not normally there.
Lets get coffee and chat and take it from there!	Let us get coffee and talk, and we will take it from there.	Let us get coffee and chat. We will take it from there.	Let us purchase coffee and converse and proceed from that point!	How about we get some coffee, chat and take it from there.
just move on with your life and frind some one eles!	Just move on with your life and find someone else.	Move on with your life and find someone else.	Simply proceed in your existence and locate an alternative person!	Just move on with your life and find someone else.
ILL BET YOUR NOT, BUT TRY TO EMAIL ME ATILIKETHICKCHIX@YAHOO.COM AND I WILL BE HONEST.	I will bet that you are not, but try to email me at ilikethickchix@yahoo.com and I will be honest.	I believe you are not ready for a relationship, but email me at atilikethickchix@yahoo.com and I will be honest with you.	If you email me, I will give you my honest opinion.	I will bet you are not, but if you try to email me at THICKCHIX@YAHOO.COM I will be honest.
Me and this boy been going off and on since last year.	This man and I have been on and off since last year.	I have been dating a boy on and off since last year.	We have been dating off and on since last year.	Me and this man have been dating on and off since last year.
I really care about you and I can't stop thinking about you.	I really care about you and I cannot stop thinking about you.	I really care about you and cannot stop thinking about you when we are apart.	I care about you, and I can not stop thinking about you.	I really care about you and I cannot stop thinking about you.
is worth  the wait when you are ready.	When you are ready, it is worth the wait.	It is worth the wait, when you are ready.	It is worth the wait when you are ready.	It is worth the wait when you are ready.
if you don't know ask someone who would.	If you do not know, then ask someone who would.	If you don't know the answer, ask someone who would know.	If you so not know, ask someone who has the answer.	If you do not know you should ask someone who would.
keep away ur fear and tell him.	Push away your fear and tell him.	Keep your fear at bay and tell him.	Hide your fears and tell him.	Repel your fear and inform him.
thats a chance your gonna have to take.	That is a chance you are going to have to take.	That is a chance that you are going to have to take.	That is a risk that you are going to have to take.	That is a risk you will have to take.
So if you want to be attractive to losers, creeps, and pervs Drink up!	So drink up, if you want to be attractive to losers, creeps and perverts!	So drink up, if you want to be attractive to deadbeats, vagabonds, and deviants.	If you are interested in being attracted to unsavory people, by all means, drink.	Therefore, if you want to be attractive to people who are unsuccessful, strange, and perverse then you ought to drink heavily.
not for anything but lookin at	Good for nothing, but enjoying visually.	Not good for anything besides looking at.	It is only for looking at it.	Not for anything other than the appearance.
After i while i t passes and i still love him	After awhile it passes and I still love him.	After a while, it passes and I still love him.	After a long time it passes and I still love him.	Even though time has passed, I still love him.
IT'S YOUR OWN LIFE, AS YOU SAID.	As you stated, it is your life.	As you said, it is your own life.	It is your own life as you said.	It is your own life, make your own decisions.
(and now even in devorce im stuck with it !	Even in divorce I am stuck with it!	And now, I am stuck with it, despite my divorce!	Even now in divorce I am stuck with it.	Even though I am getting divorced, I am still stuck with this.
just because he has the potential to be a great boyfriend doesnt mean he is.	Just because he has potential to be a great boyfriend does not make him one.	Just because he has the potential to be a great boyfriend, does not mean that he is.	Just because he has the potential to be a great boyfriend does not mean he is.	Just because he has potential to be a decent boyfriend, does not mean that he will be.
sure let me know more 'bout you	Sure, tell me more about yourself.	Sure, let me know more about you.	Sure, let me know more about you.	Of course, let me get to know you more.
when one minute you want to throttle the other person & the next you want to jump their bones	One minute you want to throttle the other person and the next you want to jump on them.	It is frustrating when one minute you would like to beat-up the person and the next minute you want to have sex with them.	When one minute you want to throttle the other person and the next you want to have sex.	One minuite you might be fighting, the other you might feel passion for them.
the girlz that are pretty or have a great personality.	I like girls who are pretty or have a great personality.	The girls who are pretty or have a great personality.	The women that are pretty, or a great personality.	I like girls that are pretty or have a great personality.
Ppl whose parents well take care of them, big time lazy ppl.	People whose parents take care of them can be very lazy.	People whose parents will take care of them are very lazy people.	People whose parents take good care of them may become lazy adults.	People whose parents take care of them are lazy.
i do not know what she wants.	I do not know what she wants.	I do not know what it is that she wants.	I do not know what she wants.	I do not know what she wants.
it is very complcated tell it again please but in simple	That sounded very complicated.  Please tell it again, but in simple terms.	It seems very complicated; Could you please explain it again in simple terms?	It is complicated. Try to tell the story again and make it simple?	It is complicated. Can you tell me in a simple way?
Show her what you're good at.	Demonstrate your skills to her.	Show her what you do well at.	Show her some of your talents.	Show her what you are good at.
if u can imagine him as the father of ur children !	If you can imagine him as the father of your children.	If you can imagine him as the father to your children!	Can you imagine starting a family with him?	Can you imagine him as the father of your children?
If you dont ask sombody else might.	If you do not ask someone else then I may.	If you do not ask, another person might.	If you're not confident enough to ask, someone else may ask instead.	If you do not ask, someone else just might.
Haha thats why I am single!	I am laughing because that is why I am single.	Haha, that is why I am not seeing anyone!	This is why I am single.	That is why I am single.
if you really love him, you would let him go...	If you really do love him, then you would allow him to go.	You would let him go if you like him.	If you love him, then you would let him go.	If you really loved him you would let him go.
