He's just incredible, I mean like took my breath away kind of stuff.	He is simply incredible, I mean to say that he is breath-taking.	He is incredible, he took my breath away.	He is incredible. It was like he took my breath away.	He is exceedingly competent, to the point where it might be described as breathtaking.
He's soo hot i don't know why Hermione won't stay with him!	He is quite attractive, and I do not understand why Hermione will not stay with him.	He is very handsome, I do not know why Hermione will not stay with him!	I do not know why Hermione will not stay with him.	He is extremely attractive, so I cannot understand why Hermione would not continue their relationship.
He just gave his opponent that don't mess with me look and went at it.	He simply gave his opponent an intimidating glance and proceeded.	He gave his opponent a frightening look and attacked.	He just gave his opponent that do not mess with me look and went at it.	He gave his opponent a look that meant not to mess with him.  Then they started fighting.
any movie with Jim Carrey in it!	Any movie with Jim Carrey in it.	I love any movie with Jim Carrey in it.	Any movie with Jim Carrey in it!	I like any movie that Jim Carrey is in.
guess it's better if you could sing that song infront of her......	It would be more preferable if you could sing the song in front of her.	I believe it is better if you could perform that song directly to her.	Guess it's better if you could sing that song in front of her.	I think it would be better if you could sing that song to her face-to-face.
I throw chili cheese dogs at my grandma all the time	I frequently propel deluxe frankfurters at my grandmother.	I throw chili cheese dogs at my Grandmother often.	I throw chili cheese dogs at my grandma all the time.	I ask my Grandma to make Chili Cheese Dogs all the time.
i tried to like him, but i just can't.	I attempted to enjoy his company but cannot.	I attempted to like him, however, I am unable.	I tried to like him, but I just can not.	I have tried to like him and I just cannot.
yes i like their songs so much	Yes, I like their songs, a lot.	I very much so enjoy their songs.	Yes, I like their songs so much.	Absolutely, I like their songs very much.
a chicken,a hyena and a jackal	It was a chicken, a hyena, and a jackal.	Three examples of an animal are a chicken, hyena, and a jackal.	A chicken, a hyena and a jackal.	A chicken, a hyena, and a jackal.
the third one was also good, but i felt it was too long.	The third one is also good. I felt it was too long.	I felt the third was too long; but, I did like it.	The third one was also good, but I felt it was too long.	The third one was also good, but I felt it was too long.
i would use the baseball beat to break the window duhhhhhhhhh	I would use the baseball bat to break the window.	I would use the baseball bat and break the window.	I would use the baseball bat to break the window.	I would use the baseball bat to break the window, silly.
queen amadala and anakin of course	Queen Amadala and Anakin of course.	Queen Amadala and Anakin.	Anakin and Queen Amadala, of course.	Queen Amadala and Anakin, of course.
capricorn has the kind of drive that scorpio respects.	Capricorn has the kind of drive that Scorpio respects.	Capricorn has the type of drive that a Scorpio can respect.	Capricorn has the drive that Scorpio respects.	Capricorn has the kind of drive that Scorpio respects.
i like their music but WAY too many tatooes for me.	I like their music but way too many tattoos for me.	I enjoy their music but they have too many tattoo's for me.	I enjoy their music, but they have too many tattoos for my taste.	I like their music but they have way too many tattoos for me.
uh.... does gay still mean Happy ?	Does gay still mean happy?	Does gay still mean happy?	"Does ""gay"" still mean ""happy""?"	Does gay still mean happy?
A tomboy does not a lesbian make.	Tomboys are not lesbians.	A tomboy is not definitely a lesbian.	A lesbian is not always a tomboy.	A tomboy need not be a lesbian.
Monk The Dukes of Hazzard Miami Vice Simpsons	I like Monk, The Dukes of Hazzard, Miami Vice, and the Simpsons.	Some of my favorite television series are Monk, The Dukes of Hazzard, Miami Vice, and The Simpsons.	Some crime comedies are Monk, The Dukes of Hazzard, Miami vice, and Simpsons.	Monk, the Dukes of Hazzard, Miami Vice, and the Simpsons.
I like almost all rock though.	I like almost all rock music, though.	I enjoy most types of rock music.	I like almost all rock music.	I enjoy most rock, though.
the used's i caught fire(in your eyes)	"I love ""I Caught Fire"" by the Used."	I enjoyed listening to The Used's, I Caught Fire (in your eyes).	The song is by The Used and is called 'I caught fire (in your eyes).'	"""I Caught Fire In Your Eyes"" by The Used."
I know ways in which they could have made it much worse.	I know the ways in whild they could have made it significantly worse.	I know many ways it could of been worse.	I know ways that they could have made it worse.	It could have been made much worse.
Just turn it on and off.	Just turn it on and off.	Merely turn it from 'on' to 'off' and vice versa.	Try turning it on and off.	Trying working the on-off switch.
LP stands 4 LINKIN PARK too...!	"LP also stands for ""Linkin Park."""	"""LP"" is an abbreviate of ""Linkin Park"" as well."	"Linkin Park can be abbreviated into ""LP."""	LP can also stand for Linkin Park.
Well, what the hell do we have now??	Well, what do we have now?	I would like to draw your thoughts to analysis of what we currently have.	What do we have now?	With what are we now presented.
2. dont whine about beig broken up with someone	Do not complain about being broken up with someone.	Do not whine concerning the end of a relationship.	Do not whine about a break up.	Do not complain that you are no longer with someone.
Rock... modern rap is disgusting and has no rhythm.	Rock. Modern rap is unappealing and has no rhythm.	I prefer the rock genre of music as I consider the rap genre to be disgusting with no rhythm.	I prefer rock over modern rap.	I prefer Rock, and d not like modern Rap, which has no rhythm.
Cant you just rhyme the words with themselves?	Can you not simply rhyme the words with themselves?	Can you not rhyme the words with themselves?	Can you not merely rhyme the words with themselves?	Can you not rhyme the words together?
THE PARENTS STOP AND HIS MOM QUICKLY DISMOUNTS, PULLING THE COVERS AROUND HER.	The parents stop; his mother quickly gets down and pulls the covers around her.	The parents stop, his mother quickly dismounts and pulls the covers around her.	The parents stop, his mom quickly dismounts and pulls the covers around her.	The parents stop and his mother promptly dismounts while pulling the blanket around her.
Yo mama so stupid it takes her two hours to watch 60 Minutes.	"""Yo mama"" is so stupid, she takes two hours to watch ""60 Minutes."""	"Your mother is so stupid, it takes her two hours to watch the TV program ""60 Minutes""."	"Your mother is rather unintelligent that it takes her two hours to watch ""60 Minutes."""	Your mother is so unintelligent that she spends two hours watching the telivision program 60 Minutes.
I've known people to pee in thier pants!	I have known people to urinate while still clothed.	I have known people to urinate in their pants!	I have known people that urinate in their pants.	Unfortunately, I have known people who urinated in their pants.
My aunt just sent me a cd with an amazing tenor named Josh Groban.	My aunt recently sent me a CD with a wonderful tenor named Josh Groban.	I just received a CD from my aunt which features an amazing tenor singer named Josh Groban.	My aunt sent me a CD with an amazing tenor named Josh Groban.	I just received a cd from my aunt. It features Josh Groban, an amazing tenor.
Screw it back in and give it a try.	Reattach it and try it again.	You should screw it back in to place and try it again.	Screw it back in and give it a try.	You could try rescrewing it back in, and then trying it again.
They're all over the place there.	They are quite abundant here.	They are all over the place there.	They're everywhere here.	They are all over the place there.
icy blue,and u can see it's breath and it will have icicles on it's nose	The color will be icy blue. You can see its breath, and there will be icicles on its nose.	I think that it will be icy blue, have visbale breath, and icicles on its nose.	It's icy blue. You can see its breath, and it will have icicles on its nose.	It is icy blue; you can see its breath, and it will have icicles on its nose.
lol just playin but they are super h-o-t	I am just teasing. However, they are very attractive.	They are very attractive.	I was just kidding, but they're very attractive.	I am just joking, but they are very good-looking.
I'd take magic over glow anyday!	I would take Magic over Glow any day.	I prefer Magic over Glow.	I prefer magic over glow at any time	I would take magic over glow, any day.
Thanks so much if anybody can help!	If anyone is able to help, thank you so much.	Thanks so much. If anyone can help, I would appreciate it.	If anyone can help, I would appreciate it very much.	Thanks you so much to anyone who can help.
no, i think they are stupid.	No, I believe that they are stupid.	No, I believe they are brainless.	I believe, rather, that they are not very smart on this topic.	I do not agree, I think they are trivial.
Good luck trying to hack my lock!	I wish you luck in trying to hack my lock.	Good luck attempting to hack into my lock.	I should warn you that it is very difficult to hack my lock.	Good luck at trying to hack my lock.
do u think 3 ppl in a band is a good amount??	Do you think that having three people in a band is a good amount?	Do you think having three people in a band is a good amount?	Do you feel than three members is a good number for a band?	Do you think that three people in a band is a good amount?
salmon or some kind of fish?	Is is Salmon or some other kind of fish?	Salmon or some other kind of fish?	Is that salmon or some sort of fish?	Salmon, or some other kind of fish?
now you can get some sleep..	Now you are able to get sleep.	Now you can get some sleep.	You can go to sleep.	Now, you can get some sleep.
final destination was good (bad acting tho) but saw is still at the top of my list	Final Destination had a good plot woth bad acting. Saw is still my favorite.	"""Final Destination,"" was good, even though it had bad acting.  ""Saw,"" is still at the top of my list."	Final destination was a good movie with bad acting.	"""Final Destination"" was good, but the acting was bad. ""Saw"" is still at the top of my list."
He's so funny and he seems so sweet.	He is funny and appears sweet.	He's funny and sweet to me.	He is very funny, and he seems very sweet.	He is so funny and he seems so sweet.
And you'll actually HAVE an experience to BACK IT UP!	You will have the experience to support it.	You will have experience to back up your claims.	Also, you will have to have an actual experience to back it up.	You will actually have an experience to back it up.
I love Tyra but I have to go with Angelina Jolie	I lie Tyra but feel that I must choose Angeline Jolie.	I love Tyra but my choice is Angelina Jolie.	I do love Tyra, but I would have to choose Angelina Jolie.	I love Tyra but I have to go with Angelina Jolie.
The Schindler's List ... the best movie i've ever seen ...	Schindler's List is an excellent motion picture.	Schindler's List is one of the best movies I've ever seen/	"""Schindler's List"" is the best move that I have ever seen."	"The best movie I have ever seen is, ""The Schindler's List""."
YOUR WASTING YOUR TIME, SAYS THE BOY.	The boy tells the other he is wasting his time.	The boy told you that you are wasting your time.	"""You are wasting your time"", says the boy."	"The boy says, ""You are wasting your time."""
he wont say anything to the girl parrot.	He will not say anything to the female parrot.	The male won't say anything to the female parrot.	He refuses to speak to the female parrot.	He will not speak to the female parrot.
'I just called to say 'I Love you'  is just great!	"I called to say ""I Love You"	I just called to say that I love you!	I just Called to Say I Love You is a fantastic song.	"""I Just Called to Say I Love You"" is wonderful."
Ask her out and treat her like a lady...tell her she's the one you're dreaming of.	Ask her out on a date, treat her like a lady, and tell her she is the one you have been dreaming of.	Ask her out, treat her like a lady, and tell her she is the one you have been dreaming of.	Ask her out and treat her like a lady; Tell her that she is the one that you are dreaming of.	Ask her on a date, treat her like a lady, and tell her she is the one that you are dreaming of.
I wouldn't throw my chili cheese dog at her and she isn't going to beat me either!!!	I would not throw my chili cheese hotdog at her, but she is not going to beat me either!	I am not throwing my food at he;r and she will not beat me either.	I would not throw my chili-cheese dog at her, nor is she going to beat me!	I would not throw my food at her and she is not going to beat me either!
But because of her, I'm writing music with a happy tone!	However, I am writing music with a happier tone because of her!	Because of her I am writing happy music.	However, because of her I am writing music with a happy tone to it.	Because of her I am writing music with a happy tone!
Tyra Banks I wouldnt know 4 sure because ive only seen Tyra Banks show	"Tyra Banks? I would not know for certain, since I have only seen the ""Tyra Banks Show."""	I would not know Tyra Banks for sure because I have only seen her tv show.	Tyra Banks, but I would not know for certain because I have only seen the Tyra Banks show.	Tyra Banks, however I would not know for sure because I have only seen the Tyra Banks Show.
Orlando Bloom or Chad M Murray are both really sexy!	Orlando Bloom and Chad Michael Murray are both really attractive!	Orlando Bloom and Chad M Murray are both very good looking.	Orlando Bloom and Chad M. Murray are both very sexy.	Orlando Bloom and Chad M. Murray are both attractive!
i think they are somewhat true i believe in ruling planets alot!	I believe they are true. I believe in ruling planets.	I think they are somewhat true.  I believe in ruling planets.	I understand that it's somewhat correct. I truly believe in Ruling Planets.	I believe certain aspects, such as ruling planets, are true.
So if I download any In Flames song, the RIAA cannot sue me, right?	If I download songs by In Flames, will the RIAA be able to sue me?	If I download any In Flames songs, can the RIAA sue me?	If I download any In Flames song, the RIAA cannot sue me, correct?	Am I correct in understanding that, if I download any song by In Flames, the RIAA cannot sue me?
i want 2 listen 2 good music but i dont knw wat 2 listen 2!!!!!!!!!!	I want to listen to music that I like but I am unaware of what to listen to.	I want to listen to good music, but I do not what to listen to.	I want to listen to good music, but I'm not sure what.	I want to listen to enjoyable music, but I do not know what to listen to.
um...well babysit i dont know good luck looking fir a job!!	I babysit, so I am unsure of the job market, but good luck in your search!	Good luck in trying to find your first job. You could always babysit.	Maybe you should babysit, I'm not sure, good luck job hunting!	You could babysit, good luck in your search for a job.
an evil fake b...h who should be put in jail for false advertising	That woman is utterly rude and dishonest. She should be prosecuted for false advertising.	She should be put in jail for false advertising.	She is an evil woman who should be incarcerated for false advertising.	An evil and fake person who should be incarcerated.
never heard of em but the actual awards are so funny.	I have not heard of them, but the awards are quite funny.	Even though I have never heard of them, I will admit the awards are quite humorous.	I have never heard of them but I think the actual awards are very hilarious.	I have never heard of them but the awards are funny.
Just play and have fun, and maybe you'll be lucky and win.	Simply enjoy yourself and perhaps you will get lucky and end up winning.	Play and have fun. Who knows, you might even win something.	Relax, just play to have fun and maybe you will get lucky and win.	I suggest you just play and have fun, you may be lucky and win.
I have seen the movie too!	I have seen that movie as well!	I have also seen the movie.	I too have seen the movie.	I have seen that movie.
Lord of the Rings: Return of the King...	Lord of the Rings: Return of the King.	"""The Lord of the Rings: Return of the King."""	"""Lord of the Rings: Return of the King"""	The Lord of the Rings movie, Return of the King.
say ur pregnant and say not from u from some1 else	Say that you are pregnant but claim that it is from someone else.	Tell him you are pregnant with someone else's child.	Say that you are pregnant, and that it is not his, but someone else's.	You are pregnant from someone else.
CHRIS AND KELLI ALL THE FREAKIN' WAY!	Absolutely, Chris and Kelli all of the way!	Chris and Kelli are definitely the best.	I say Chris and Kelli until the end.	Chris and Kelli are going all the way.
yea i heard they broke up too	Yes, I also heard that they broke up.	Yes, I also heard that they are no longer together.	Yes, I also heard they broke up.	I heard they broke up.
Yeah he is fucking hot and so is his music.	Yes he and his music are both very sexy.	Yes he is provocative and so if his music.	He is very talented and good looking..	He is very sexy and so is his music.
The First Time Ever I Saw Your Face.	"I would say ""The First Time Ever I Saw Your Face."""	"""The First Time Ever I Saw Your Face"""	It was the first time I every saw your face.	The First Time Ever I Saw Your Face.
who sings the song I don't like the looks of it?	"Who sings the song ""I Don't Like the Looks of It""?"	"Who sings the song, ""I Don't Like The Looks Of It""?"	"Who sings the song, ""I don't Like the Looks of It""?"	Who sings the song, I Don't Like The Looks Of It?
I personally don't believe in them.	I personally do not believe in them.	I personally do not believe in them.	I don't believe in them personally.	I personally do not believe in them.
Yo mama so stupid she called Dan Quayle for a spell check.	Your mother is so stupid that she called Dan Quayle for a spell check.	Your mom called Dan Quayle to check the spelling.	Your mother is so dumb, she called Dan Quayle for a spell checker.	Your mother attempted to phone Dan Quayle for spell check.
Im not a little scary beotch so i can do all the stuff that they do ya know.	I can do all the things that they do and I am not a scary little girl!	I am not scared and can do everything they do.	I am not scary, so I can do all the stuff that they do, you know?	I'm not frightened. I'm able to the same as them.
what the hell do u mean???	What do yu mean by that?	What do you mean?	What do you mean?	What exactly are you stating?
noo he siad that he liked her thats is what he rumor wass	There was a rumor going around that he said that he really liked her.	The rumor is that he liked her.	No, he said that he liked her. That is what the rumor was.	The rumor was that he might of said he was attracted to her.
a genetic supercool monster full of charm and humour and good looks...smokin !	A genetic super cool monster full of charm and humor and good looks smoking!	I am attracted to the fact he is a genetic monster with charm, humor, and good looks.	A genetically superior monster full of charm, humor, and good looks. You are very attractive.	A super cool, genetically-altered monster full of charm, humor, and good looks. Smoking!
at what maximum speed a couple make love?	at what maximum speed a couple make love?	At what top speed can a couple make love.	What is the maximum speed at which a couple can have intercourse?	At what maximum speed does a couple make love?
i was reading an answer of yours & am impressed, youre cool.	I was reading an answer of yours and I am impressed, you are cool.	I was reading your answer and I am impressed.	I was reading one of your answers and I am impressed. You are enjoyable to be around.	I was reading one of your answers, and I am impressed. You are cool.
also he looks as creepy as hell	also he looks creepy as hell?	He looks extremely creepy	Also, he is strange-looking.	He also looks incredibly creepy!
Shes jus a useless slob makin money over other ppl's troubles.	She is just a useless slob making money over other people's troubles.	She is a bad person, making money on other peoples troubles.	She is a useless person who makes money from the troubles of others.	She is just a useless slob, who makes money off of other peoples' troubles.
it depends on the type of gum ur chewing	That would depend on the type of gum, or the chewing.	It depends on the type of gum you are chewing.	It depends on the type of gum you are chewing.	It depends on what type of gum you are chewing.
yeh, i know, that was lame	Of course, I know that was feeble.	Yeah, I know, that was lame.	Yes, I know, and it was lame.	Yes, I know, that was a poor excuse.
i'm the only person in the entire country that doesn't think dave chappelle is funny.	I am probably the only person in this country who thinks Dave Chappelle is not funny.	I am the only person in the entire country that does not think dave chappelle is funny.	I am the only person in the entire country that does not think Dave Chapelle is funny.	I am the only person in the country that doesn't find Dave Chappelle funny.
The doc said  wot on earth have u been up to  ?	The doctor was startled and wanted to know what I have been doing.	The doctor said what on earth have you been up to?	"The doctor said, ""What on Earth have you have you been up to?"""	"The doctor said, ""What on earth have you been up to?"""
One of you would have to sing.	Of course, one of you would need to be the singer.	One of you would have to sing.	One of you would have to sing.	One of you would have to sing.
Why don't you share where you're from?	Please tell me where you come from.	Why do you not share where you are from?	Why do you not share where you are from?	Why do you not share where you are from?
oprah of course cuz she gives better advice and has done it longer	It would be Oprah, of course, because she gives the best advice and has done so for a long time.	The best choice is Oprah because she gives better advise and has been doing so for longer.	Of course it is Oprah, because she has been providing better advice for a longer time.	Oprah, of course, because she gives better advice and has done it for a longer period of time.
But all the same iv'e liked them since i was a kid!	But all the same, I have liked them since I was a child.	I have liked them since I was a kid.	All the same, I have liked them since I was a child.	All the same, I have liked them since I was a child.
I LIKE HOW MAYA KEEPS IT REAL.	I like how real Maya keeps things.	I like how Maya keeps it real.	I appreciate that Maya is genuine.	I like that way that Maya is down-to-earth.
Sell the baby to the movies	Selll the baby to the movies.	Sell the baby to the movies.	fragment/doesn't make sense	Allow Hollywood to purchase the newborn.
I think its a bit cheezy to name it though, but maybe I maybe name it Jet	I believe it should not have a name, however, if I had to pick on, I would pick Jet.	"In my opinion it is tawdry to name it, but maybe I will name it ""Jet."""	It's a cheesy name but you could name it Jet.	My opinion is it's somewhat low-class to call it by name however perhaps I'll refer to it as Jet.
Did you ever hear the last song on the albulm Having a Roni??	Have you listened to the final song on the album Having a Roni?	"Have you heard the last song on the album ""Having a Roni""?"	Have your head the final song on Having a Robin?	"Have you ever listened to the final song on the record ""Having a Roni?"""
mama so ugly, she scares buzzards off of a meat wagon.	Your mother is so unattractive she scared buzzards off of a meat wagon.	Your mother is so ugly that she scares buzzards off a meat wagon.	Your mother is so ugly that scares buzzards away from the meat wagon.	Mother is so unattractive, she frightens buzzards away from a meat truck.
i want to make fullmetal alchemist videos	I want to make Fullmetal Alchemist Videos.	"I want to make videos for ""Fullmetal Alchemist."""	I want to make videos with Full Metal Alchemist	I have a desire to produce videos on Full Metal Alchemist.
Beyonce can't sing, dance, or act and Rihanna(who?)	Beyonce cannot sing, dance, or act.  As for Rihanna, who is that?	I do not think Beyonce can sing, dance, or act. You mentioned Rihanna, who is that?	Beyonce can't sing, dance, or act very well.	Beyonce cannot sing, dance, or act, and I don't know who Rihanna is.
just a dum funny question hahahaha	Just a senseless, funny question.	It was just a silly question.	That was a funny question.	That is a stupid and silly question.
jerry, jerry, jerry........he must have picked up some skills after seeing all those fights up close!	Jerry must have picked up some skills after seeing all of those fights up close.	I think Jerry Springer has picked up some skills after witnessing all those fights.	He must of learned some skills after seeing all those fights.	Jerry, he must have picked up skills after seeing so many up close fights!
And people ?wonder why he's not married.	And people wonder why he is not married.	People wonder why he is not married.	That's why people wonder why he's not married.	People wonder why he is not married.
theres this song i have no clue wut it is.	There is this song and I have no clue what it is.	I know of a song, but I cannot remember how it goes.	I wish I knew the name of that song.	There is a song, but I have no idea what it is.
