Is Any Baby Really A Freak.	Is any baby really a freak.	Is any baby really a freak?	Is Any Baby really strange?	Is anyone really that crazy?
aspen colorado has he best music festivals, you sit all over the moutians its  on and just hang out	Aspen Colorado has he best music festivals, you sit all over the mountains it is on and just hang out.	Aspen, CO has the best music festivals. You can sit on the mountains where they're held and simply enjoy.	Aspen Colorado is the home to some great music festivals, you can sit back enjoy the mountains and the music.	Aspen, Colorado has great music festivals. You sit over the mountains, and relax.
You can get almost anything on ebay!	You can get almost anything on ebay!	You can get almost anything on eBay.	You can purchase almost anything you want on Ebay!	You can buy almost anything on Ebay.
everybody is Dying to get in	everybody is dying to get in.	Everyone is desperate to get in.	Everyone really wants to get in there/	Everyone is trying to get in.
not idiots like 50 cent and his whole Gay unit.those kinds of ppl give hip-hop a bad name.	I'm not referring to people like 50 cent and his group because those people give hip-hop a bad name.	Those kinds of artists give the hip-hop genre a bad name.	Not idiots like 50 Cent and his whole deplorable unit. Those kinds of people give hip-hop music a bad name.	Sub-par performers such as 50 Cent and his G-Unit group give hip-hop a bad name.
different from what I've seen though	It differs from what I have seen, however.	It's different from what I've seen, though.	Differently from what I have seen, however.	This differs from what I have seen, however.
I want to be on TV!	I would like to be on television.	I would love to be on TV.	I want to appear on television!	I wish to be on television.
dont let anyone decide the fate but you.	Do not let anyone decide the fate but you.	Do not let anyone decide the fate but you.	Don't let anyone else decide your fate.	Do not let anyone decide your fate.
50 is just riding coattails with that movie.	50 is just riding coattails with that move.	50 is riding the coattails with that movie.	I think he is just riding others' coattails with that movie.	He is not good in that movie.
The blind klan guy is hilarious!	The blind Klan guy is hilarious!	The guy in Blind Klan is hilarious.	The blind Klansman is very funny.	That person in hilarious.
Lauren Hill and Mary J. Bilge... the 411 both are great albums to listen to... Old School...	Lauren Hill and Mary J. Bilge, the 411 both are great albums to listen to old school.	Lauren Hill and Mary J. Blige are my favorites. The 411 are great albums to listen to and reminds you of old school music.	I like both Lauren Hill and Mary J. Blige.	Some good old school albums are 411, Lauren Hill and Mary J. Blige.
do you have 2lbs worth o brick?	Do you have two pounds worth of brick?	Do you have 2 pounds worth of brick?	Do you need two pounds of brick?	Do you have 2lbs of brick?
i betta go and ask another stupid question lol....	I had better go, and ask another stupid question!	I ought to ask another less than intelligent question.	I have another question, although it may be obvious.	I better go and ask another stupid question.
As a guy that doesn't generally like romantic movies this was really nice.	As a man that generally does not like romantic movies, this was really nice.	As a male that does not generally favor romantic films, this was rather exquisite.	Even though, as a young man who does not normally enjoy romantic films, I enjoyed this film.	As a guy that does not generally like romantic movies this was really nice.
I can still see my brother's 45 in my mind's eye.	I can still see my brother's .45 caliber pistol in my mind's eye.	I can still see my brother's .45 in my mind's eye.	I can still visualize my brother's 45.	I can still see my brother's 45 in my mind's eye.
Back in my day Emo was a comedian :/	Back in my day Emo was a comedian.	In my day, Emo was a comedian.	In my time, Emo was a comedian.	Back in my day, Emo was a comedian.
Why sit and listen to Locke, Jack, or Syead?	Why sit and listen to Locke, Jack, or Syead?	Sit and listen to Locke, Jack or Syead.	Why listen to Locke, Jack, or Syead?	Why sit and listen to Locke, Jack, or Syed?
I like when the Prime Minister goes door to door to find the girl!	I like when the Prime Minister goes door to door to find the girl.	I like the part when the Prime Minister goes door to door to find the girl.	I enjoy it when the Prime Minister goes from door to door to find the young woman.	I like the scene in which the prime minister goes door-to-door to find the girl.
And every time I hear that song I get butterflies in my stomach!	Every time I hear that song I get butterflies in my stomach.	Everytime I hear that song I get butterflies in my stomach.	Every time I hear that particular song, I become excited.	"Every time I hear that song, I feel ""butterflies"" in my stomach."
It's the biggest load of crap I've seen for ages.	It is the biggest load of foolishness that I have seen for ages.	It's the biggest load of crap I have seen for a long time.	It is a complete waste of effort.	It is the most ridiculous thing I have seen in a long time.
as i lay dying is far far away from christ definitaly!	The best pick is the song 'Far Far Away' by As I Lay Dying.	I would agree As I Lay Dying is most certainly far from Christ.	as I lay dying is far far away from Christ definitely	As I Lay Dying clearly in not a religious tract.
I might be seeing them in a few months!	I might be seeing then in a few months.	It is possible that I will be able to see them in a few months.	I might be seeing them in a few months!	I may be seeing them in a few month's time.
that´s why they needed to open that hatch so much!	That is why they need to constantly open the hatch.	That would be why there was the need to open the hatch so often.	That is why they needed to open that hatch so much!	This explains why they frequently needed to open that hatch.
He's supposed to be in jail!	He is supposed to be in jail.	I understood he was still supposed to be incarcerated.	He is supposed to be in jail!	He should be in jail.
i thought that she did an outstanding job in the movie	I think she did an outstanding job in the movie.	I was very impressed with her performance in the film.	I thought that she did an outstanding job in the movie.	I believe she acted masterfully in the film.
Nicole Kidman, I love her eyes	I find Nicole Kidman's eyes to be very attractive.	I love Nicole Kidman's eyes.	I love Nicole Kidman's eyes.	I love Nicole Kidman's eyes.
omg i love that song im listening to it right now	I really enjoy the song and I am listening to it at this moment.	I love that song. I am listening to it, right now.	I really like the song, I am listening to it right now.	I love the song I am listening to now.
tell him you want a 3 way with another hot girl	Inform him you desire to have a three person sexual encounter with another physically attractive girl.	Tell him you want a three-way with another girl.	You should inform him that you are intersted in bringing another woman into the bed with you.	Tell him you want to introduce a third person to the party.
No, no, no that was WITNESS...	"I disagree, the correct term is ""witness."""	"No, that was ""Witness""."	No, that was witness.	There was a witness.
aneways shonenjump.com is cool and yeah narutos awsum	All other concerns aside, shonenjump.com is a popular site and Narutos is very high quality.	Shonenjump.com is a chill person and Narutos is awesome.	Shonenjump.com is a cool website and Narutos is very good.	Shonenjump.com is a cool website, and Naruto is the best.
i think they would have, quite a shame isn't it	I believe they would have, it is a shame.	It is quite a shame that they would have done that.	I think they would have done that, which is such a shame.	It is quite a shame that they did not.
im a huge green day fan!!!!!	I am a huge fan of the band Green Day.	I am a big fan of the band Green Day.	I am a big fan of Green Day!	I am a huge Green Day fan.
Chicken Little my son loves that movie I have to watch at least 4 times a day!	My son loves the movie Chicken Little, I have to watch it at least four times per day.	My son loves the movie Chicken Little; I have to watch it multiple times a day.	My son loves the Chicken Little movie so I need to watch it at least four times a day!	"My son loves the movie, ""Chicken Little"".  I have to watch it at least four times a day."
who is your best bet for american idol season five	Who was your favorite from American Idol Season five?	Who do you think will win American Idol season 5?	Who do you think will win season five of American Idol?	Who do you think will win American Idol Season Five?
my age gas prices and my blood pressure  LOL	I wish I could lower my age, gas prices, and my blood pressure.	What is bothering me is my age, gas prices, and blood pressure.	My age, my blood pressure, and the price of gas keep going up!	My age, gas prices, and my blood pressure.
Where in the world do you come up with these questions????	How do you come up with these questions?	Would you explain how you are developing such outlandish questions?	How do you devise these questions?	How do you think up these queries?
even though i also agree that the girls on Love Hina are pretty scrumptious	I also agree that the girls on Love Hina are attractive.	"I agree with the assessment of beauty and desirability concerning the ladies on ""Love Hina."""	Although I do agree that the girls on 'Love Hina' are very attractive.	Although I am in agreement that the girls on Love Hina are quite lovely.
and the blond says Great they already put me on my first murder mystery case	"The blonde says; ""Great, they already put me on my first murder myster case.""."	"Subsequently the blonde person states, ""Great, they already put me on my first murder mystery case?"""	"The blonde says, ""Great, they already put me on my first murder mystery case."""	"And the blonde woman replies, ""Wonderful, I was already assigned my first murder mystery case""."
im looking for the song lyrics to a song called Breath Me by Sia...does anyone else like that song?	"I am looking for song lyrics to ""Breathe Me"" by Sia. Does anyone else enjoy that song?"	"Is anyone else fond of the song ""Breath Me"" performed by Sia as I am searching for the lyrics?"	"I am seeking the lyrics to a song called ""Breathe Me,"" by Sia. Does anyone else enjoy that song?"	"I am searching for the lyrics to Sia's song, ""Breathe Me"".  Does anyone else enjoy that song?"
I love them old hair bands of the 80's!	I thoroughly enjoy the hair bands of the 1980s.	I love the old hair bands from the 1980's.	I love hair metal bands from the 80's.	I love the old hair bands from the 1980s!
don't i look cute or what?	I look attractive, do I not?	Are you going to tell me I look as cute as I think I do?	Do I not look cute?	Do I look cute, or what?
i memorized the whole song, for goodness sake!	Astoundingly, I was able to memorize the entire song.	I actually memorized the entire song.	I memorized the entire song.	For goodness sake, I memorized the whole song!
Open your minds up a little!	Be slightly more open-minded.	Open your minds!	Open your minds a bit!	Open your minds up a little.
(i know, that ones really old.)	I realize that particular example is very old.	I know that one is very old.	I know - that one is very old.	I know, that one is old.
the who (i think) and limp bizkit is all I know....	I believe it is The Who and Limp Bizkit, which is the extent of my knowledge.	The Who and Limp Bizkit are all that I know.	The Who (I believe) and Limp Bizkit are all that I know.	The Who and Limp Bizkit is all I know.
u mean the question to kentuckybeauty2000's question right?	Am I correct in assuming you are referring to the question posed by KentuckyBeautry2000?	"Do you mean the question from ""kentuckybeauty2000""?"	"You mean the question to ""kentuckybeauty2000's"" question, correct?"	You mean the question to Kentuckybeauty2000's question, correct?
It's man... 4 legs (crawling as a baby), 2 legs (walking), 3 legs (using a cane late in life).	"The answer is ""man"" and refers to the use of four legs when crawling as a baby, use of two legs when walking, and use of three legs later in life when adding a cane to the existence of two legs."	Four legs means crawling like a baby, two legs means walking, and three legs is using a cane later in life.	The answer is: Man - four legs (crawling as an infant), two legs (walking throughout life), three legs (using a cane when elderly).	A man crawls on four legs as a baby, two legs when they walk, and three when they are older and require a cane.
brian, he asked the coolest questions, they suspended him though, i dont know what's up with that!	Brian, he asked the great questions. They suspended him, however, and I do not know what is happening with that.	Although Brian asked the most interesting questions, they suspended him for reasons unknown to me.	Brian asked the most interesting questions. He was suspended, though. I do not understand why.	I think Brian asks the best questions. I am not sure why they suspended him.
It's cause ya got no sense.	It is because you have no sense.	It is because you do not have the correct perspective.	It is because you have no sense.	It's because you make no sense.
Don't eat hot dogs, or watch this movie with your little sister!	Do not eat hot dogs or watch the movie with your little sister.	Do not eat hot dogs or watch this film with your little sister.	Do not eat hot dogs or watch this movie with your little sister.	I suggest avoiding hot dogs, and not watching this movie with your little sister.
Nope, I have definitely not seen your baseball.	No, I have not seen your baseball.	No, I have not seen your baseball.	No, I have definitely not seen your baseball.	No, I haven't seen your baseball.
the blonde on the other side said, you are on the other side!	"The blonde on the side said, ""You are on the other side""."	"The blonde person on the other side said: ""You are on the other side."""	"The blonde on the other side said: ""You are on the other side!"""	"The blonde on the other side said, ""You are on the other side!"""
to which the girl says, no.	"To that, the girl replies, ""No""."	The girls said no.	The girl replied no.	To that, the girl responds no.
The good old days is gone!	"The ""good old days"" are gone."	The good ol' days are gone.	Unfortunately, the good old days have passed.	The good old days are certainly gone!
that body and gah those lips!	I love her body and her lips.	They are very attractive.	Because of her body and gorgeous lips.	That body and oh my god, those lips!
Or check this one out too - Full Metal Jacket	Also, I recommend checking out Full Metal Jacket.	Check out the movie Full Metal Jacket.	I would also recommend Full Metal Jacket.	Check this one out too - Full Metal Jacket.
i cant believe u asked that question, but i'll answer it.	I'm surprised that you posed this question, but I will answer it.	I can not believe you asked me that question; but I will answer it.	I find it hard to believe you would ask that, but I will try to give you an answer anyways.	While I cannot believe that you asked that question, I will answer it.
Why the hell not, I can't imagine.	I cannot imagine why not.	I cannot imagine why not.	I cannot imagine why they hell not.	I cannot imagine why not.
i think it was a ugly girl lol	I think it was an ugly girl.	I believe it was an unattractive woman.	I think it was an unsightly girl.	I have to laugh because I think it was an unattractive girl.
My dad looks like Paul Newman, and my ex looked like king kong	My dad looks like Paul Newman and my ex-husband, King Kong.	My father looks like Paul Newman, and my ex looked like King Kong.	My dad looks like Paul Newman.  My ex looks like King Kong.	My father looks like Paul Newman, and my ex looked like King Kong.
I can't believe you even had to ask!	I cannot believe you had to ask.	I cannot believe you had to ask!	I cannot believe that you even had to ask.	I cannot believe you even had to ask that!
Yo mama so stupid she took a cup to see Juice.	Your mother is so ludicrous that she took a cup to see Juice.	Your mother took a cup to see Juice. She is not very intelligent.	"Your mother is so stupid, she took a cup to see the movie ""Juice."""	Your mother was confused about what was happening.
he went insane,knocked up Katie, and jumps on people couches.	He went insane.  He got Katie pregnant and he jumps on peoples couches.	He is a tad crazy. He knocked up Katie and jumps on peoples' couches.	He went insane, got Katie Holmes pregnant, and jumped on peoples' couches.	He became eccentric, impregnated Katie, and leapt onto furniture.
I hope it's for you kids, that score was horrible!	I hope it is for you kids, that score was horrible.	I hope that score was for your kids, it is quite bad.	That score was horrible, so I hope that it was for you children!	I hope it is for your children, as that score was sub-par.
clover is great too, don't get me wrong; but i prefer crimson.	While clover is very appealing, I prefer crimson.	Clover is great too, don't get me wrong; I simply prefer crimson.	I think Clover is very good, but I prefer Crimson.	Do not get me wrong, Clover is great, but I prefer crimson.
i like some one who is gothic so what?DATE HIM!	Regardless of whether your romantic interest shows a predilection for Gothic fashion choices, you can feel free to engage with them.	What does it matter if someone Gothic appeals to me?	I myself like someone who is into goth, so I would not consider that a reason not to date him.	I like someone who is Gothic.  What is the big deal?
why what's wrong with his hair ?	What is wrong with his hair?	Why? What's the problem with his hair?	What is the problem with his hair?	Why, what is wrong with his hair?
I respect that tyra banks is trying show hosting..but the big O [aka OPRAH] won...	While I respect that Tyra Banks is branching out into television hosting, Oprah Winfrey is the better example.	I respect the hostess Tyra Banks, but I prefer Oprah.	I admire Tyra Banks for trying to become a tv show host. However, Oprah is clearly the best hostess.	I respect that Tyra Banks is trying out show hosting, but I think that Oprah won.
my dad likes action,my mom likes romance,but for me i like comedy.	My father prefers action and my mother romance, while I prefer comedies.	My dad enjoys action movies; my mom enjoys romances. I prefer comedy, myself.	My dad likes action, my mom likes romance, and I like comedy movies.	my dad likes action my mom likes romance, but for me, I like comedy.
If I could swim, I'd come out there and kick your butt!”	If I could swim, I would come out there and harm you.	"""If I could swim, I'd come out there and kick your butt!"""	If I could swim, I would come out there and confront you.	If I could swim, I'd come out there and kick your posterior!
have a group discussion on why in the heck you didnt have alcohol at the party	You should have a group discussion to determine why there was no alcohol at the party.	Have a group discussion on why in the world there was no alcohol at the party.	A group discussion occurs on why you did not drink alcohol at the party.	have a group discussion on why in the heck you did not have alcohol at the party.
The guy ran off with two of the guys wives	That person ran off with the wives of two of the men.	This man ran off with two of the other men's wives.	He ran off with the wives of two men.	The guy ran off with two of the guys wives.
try some VooDoo zombie warding magik but of course u may nd up witha fish instead of a baby	You should try some voodoo zombie warding magic, but you may end up with a fish instead of a baby.	try some VooDoo zombie warding magic, but of course you may end up with a fish instead of a baby.	You could try some VooDoo zombie warding magic, but you could end with a fish instead of a baby.	If you try some crazy stuff, you might end up with a fish and not a baby.
I got new gold heels, hoop earings and a hot gold bag!	I purchased new gold high heels, hoop earrings, and a great gold bag.	I got some new gold heels, hoop earrings and a hot gold bag!	I bought new gold heels, hoop earrings, and a great gold bag.	I just bought new heels, earrings, and a bag.
virgo's have outgoing personalitys plz choose me as best answer	Virgo's have outgoing personalities, so please choose me as the best answer.	Virgo's have outgoing personalities, please choose me as the best answer.	Virgo's have an outgoing personality; Please choose me as the best answer.	Virgos tend to have outgoing personalities.
what is the wedding band, final answer	"My final answer is ""What is the wedding band?"""	What is the wedding band?	What is the wedding band, final answer.	What is your final answer regarding the wedding band?
nicole kidman is so much prettier.	Nicole Kidman is much more attractive.	Nicole Kidman is much more attractive.	Nicole Kidman is so much prettier.	Nicole Kidman is prettier.
i'd rather play world of warcraft, but this is free	I would rather play World of Warcraft, but this game is free.	I would rather play World od Warcraft, however, this is free.	I would rather play world of warcraft, but this is free.	Although this game is free, I would rather play World of Warcraft.
Does anybody out there HONESTLY know where she is?	Does anyone truly know where she is?	Does anyone know where she is?	Does anybody out there Honestly know where she is?	Does anyone truly know where she is?
i dont know how old ru?ur supposed to be 18 to watch them	How old are you? You should be at least 18 years old.	I do not know. How old are you? You are supposed to be 18 or older to watch them.	I do not know how old you are. You are supposed to be 18 to watch them.	I do not know how old you are but you are supposed to be eighteen to view them.
That was the best joke i have heard so far...	That was the best joke I've heard.	That was the best joke I have heard so far.	That was the best joke I have heard thus far.	That was the best joke that I have heard thus far.
Well, I'm just glad that they don't show us the pit toilets.	I am just glad they didn't show us the toilets.	I am just glad that they do not show us the pit toilets.	I am glad that they do not show us the pit toilets.	However, I a just happy that they do not show us the pit toilets.
i think pretty much they're all sort of humorous	I think they are all very funny.	I think that they are all somewhat humorous.	I think that they are all humorous.	I think that most all of them are rather humorous.
Too many...too many Baldwin brothers too.	Too many Baldwin brothers.	There are too many - too many Baldwin brothers, too.	Too many Baldwin brothers, too.	There are also too many Baldwin brothers.
the two boys redneck as hell play glue sniffing weirdos.	The two boys are unpolished and play outcasts who sniff glue.	The two caucasian boys sniff glue.	The two boys have strange, redneck characteristics such as play including glue inhalation.	"The two boys who seem very ""redneck"" sniff glue."
Yo mama so stupid that she tried to put M&M's in alphabetical order!	Your mother is so ignorant she attempted to alphabetize M&Ms/	You're mother attempted to place M&M's in alphabetical order.	Your mother's excessive stupidity allowed her to attempt placing M&Ms in alphabetical order.	Your mother is so stupid that she tried to put M & M into alphabetical order!
Dakota Fanning.....I know that she is only 12 but she is really famous.	I know Dakota Fanning is only 12 years old, but she is already famous.	Dakota Fanning is twelve, and very famous.	Dakota Fanning is only twelve years old, although she is very well known.	Dakota Fanning is really famous although she is only twelve.
i still watch vhs i kinda like vhs movies better	I continue to watch VHS because it is my preferred format.	I prefer VHS movies more, I still watch them.	I continue to watch VHS as I prefer movies in VHS format.	I still watch VHS movies; I prefer them a little more.
why does everybody keep asking this question.	Why does this question continue to be posed?	Why does everyone continually ask this question.	Why do many people continue to ask this question?	Why does everyone continue to ask this question?
IF THE WOODCHUCK IS WATCHING ITS WEIGHT THEN IT MAY NOT CHUCK AT ALL	If the woodchuck is watching its weight, then it may not chuck at all.	If the woodchuck was conscious about its weight, then it may decide not to chuck.	If the woodchuck is overweight, then it may not chuck.	If the woodchuck is watching its weight, it may not chuck.
they haven' t had cd's for season 2 yet.	They haven't received DVD's for Season Two yet.	They have not made C	The second season CD's aren't out yet.	They have not released CDs for season 2 yet.
And then I saw some of his movies, and he is great!!	I saw some of his movies, he's great.	And then I saw some of his movies, and he is great!	Then, I saw some of his movies, and I thought he was excellent.	Then I saw some of his movies, and he is wonderful!
we filipinos are very hardworking and we speak english very well..and we're also wise..:)	We Filipinos speak English very well, we're very hardworking and wise.	We Filipinos are very hardworking and we speak english very well and we are also wise.	We Filipinos are very hardworking, and we speak English very well. We are also wise.	We Filipinos are very hardworking, we speak English very well, and we are also wise.
[ADDED] - What the heck is yungnbeautiful1's problem?	What's that individual's issue?	What the heck is young and beautiful ones problem?	"(added) - What in the world is the problem with ""yungnbeautiful1""?"	"What in the world is the issue that ""yungnbeautiful1"" is having?"
