I think he'd be alot more liked if he wasn't so outspoken about politics.	I think that he would be liked a lot more if he were not so outspoken about politics.	I think people would like him more if he didn't talk about politics.	I believe he would be more well-liked if he was not as outspoken about politics.	I think he would be much more liked if he was not so outspoken about politics.
try limewire.com its free, you have to download it.	Try Limewire.com; It is free but you have to download it.	Try Limewire, it is free, you just need to download it.	You might try Limewire.com, a free program which requires a download.	You should try limewire.com's free download.
of course... animal crackers are made to be delicious and cute.	Animal crackers are baked to be delicious and cute.	Most definitely, animal crackers were created to be both cute and delicious.	Of course, animal crackers are meant to taste good and be visually cute.	Animal crackers are delicious and cute.
It's one of my all time favorites!	It's one of my favorites.	It ranks high on my favorites list.	It is one of my favorites.	That is one of my favorites!
doyle brunsen wrote an excellent book if ya havent read it yet.	You might not of read Doyle Brunsen's excellent book yet.	In case you have not been able to read it yet, Doyle Brunsen has written an excellent book.	Doyle Brunsen wrote an excellent book, if you have not read it yet.	If you have not read it, Doyle Brunsen wrote an excellent book.
I don't pick them in the first place.	I didn't get to choose them in the first place.	First of all, I do not choose them.	I do not choose them initially.	I did not pick them in the first place.
I just watched that movie M.C.	I just watched that movie.	I just watched that movie.	I just watched that movie!	I recently viewed the film M.C.
i dont know and didnt see it	I do not know and did not see it.	I do not know and I did not see it.	I don't know; I did not see it.	I do not know and was unaware of it.
it depends on what kind of music u like.if u r into rap check 2pacs letter to my unborn	"It depends on what kind of music you like. If you like rap, you should listen to ""My Unborn"" by 2PAC."	"It depends on what kind of music you like.  If you are into Rap, then check out Tupacs, ""Letter to My Unborn."	"It all depends on what style of music you prefer. If you like rap, Tupac's ""Letter to my Unborn"" is a good choice."	"It depends on what type of music you enjoy; if you enjoy rap, listen to 2Pac's ""Letter to My Unborn."""
thats the stupidest thing I have ever heard.	That is the stupidest thing I have ever heard.	That is the stupidest thing I have ever heard.	That's a very silly idea.	That is unintelligble to me.
lol i know what they're called, udders!	"I know that they are called ""udders."""	I do not know what they are called, udders!	I'm aware of the term, udders!	That's funny, they are called udders!
I want my Cd to play in my car's CD player and in my walkman.	I want to play CDs in my car's CD player and in my walkman.	I want my CD to play in my car CD player and also in my walkman.	My desire is for my CD to function in my vehicle's CD player, and also in my Walkman.	I would like my CD to play in both my car's CD player and in my Walkman.
Yo mama so stupid she sold her car for gasoline money!	Your mother is so stupid she sold her car for gasoline money!	Your mama is so stupid, she sold her car for gas money!	Your mother needs a new car.	Your mother's stupidity is so excessive she sold her car to acquire money for gasoline.
i do i'm a girl and only lesbian pornos turn me on	I am a woman and I enjoy lesbian porn.	I'm a girl, and I find that only lesbian porn appeals to me.	I do; as a female, prefer women loving women.	I do as I am female and only aroused by pornography featuring lesbians.
Don't worry, I got your back!	Do not worry, I support you!	Don't worry, I'm here for you!	Do not be concerned, I am on your team.	Do not worry as I support you.
i'd probably drink up everything in the damn bar to even think of finding u attractive.	I would probably drunk everything in the bar to even find you attractive.	Unfortunately, it would take all the alcohol in the bar for me to think you were attractive.	I would likely need to become highly intoxicated before I found you attractive.	In order to find you attractive, I would have to drink everything in the bar!
srry i didnt c it yet but every 1 else ruiened it 4 me!	Sorry, I did not see it, yet. But, every one else ruined it for me.	I regret I have not seen it, however, the comments by others have ruined it for me.	I apologize; I have not seen it yet, although everyone else told me the details.	Sorry, I did not see it, so everyone else ruined it for me!
A weird question :) I don't like them both, but Salvador Dali is more talented definitely.	This is a strange question; I do not like either of them, however Salvador Dali is certainly more talented.	That is a strange question. I do not like them but I believe that Salvador Dali is definitely more talented.	It was a strange question. I do not like them, but Salvador Daili is talented definitely.	That is a weird question. I do not like them both, but Salvador Dali is more talented.
yes, and how did u get the beans above the frank?	Yes. Can I ask how you put the beans on top of the frank?	Yes, how did you get the beans above the frank?	Yes - and how did you get the beans above the frank?	Yes, how did you get the beans above the frank?
I guess they can't eat gummi bears either.	I assume they can not eat Gummi Bears as well.	I suppose they cannot eat gummy bears, either.	I suppose they cannot eat gummi bears, either.	I guess they cannot eat gummi bears either.
people should not be afraid of thier government, government should be afraid of thier people.....	Citizens should not have to feel afraid of the governement. The government should be afraid of the reactions of citizens if it is in the wrong.	People should not be afraid of their government. Government should be afraid of their people.	People should not fear their government. The government should fear the people.	People should not be afraid of their government.  Government should be afraid of their people.
They just want to express what they like and making a banging tune  :)	They are simply interested in expressing themselves, and creating a lively tune.	They want to express what they like and make a great song.	"They just want to express what they like and make a ""banging"" tune."	They want to express what they like by making a banging tune.
I would not want a funeral party thrown for me  Thanks anyway!!!	Thank you for the thought, but I would not desire to have a funeral party in my honor.	I would not want a funeral party thrown for me, thank you anyway.	I would not want a funeral party thrown for me. Thank you all the same.	Thank you, but I do not want a funeral party thrown for me.
there was a brunette team and a blonde team.	The teams included a brunette team and a blonde team.	There were two teams- a brunette, and a blonde.	There was one brunette team and one blonde team.	There were two teams: the brunettes and blondes.
(not to be mean, just lettin you know) :)	I do not intend to be mean, I am merely informing you.	I am not trying to be mean.	I am not trying to be rude, I just want you to know.	I do not intend to be mean, I am simply informing you.
She's as trampy as the others!	"She has the same amount of undesirable ""tramp"" characteristics as the others."	She is just like the others.	She is not morally right.	"She is not so ""innocent."""
Cheech and Chong's Up In Smoke	"Cheech and Chong created ""Up In Smoke."""	The movie is Cheeh and Chongs 'Up In Smoke.'	The movie Cheech and Chong's Up In Smoke.	"I like Cheech and Chong's ""Up In Smoke."""
i have too many ,but maroon 5 and life house are my favorites absolute , and the all songs	I have too many. However, 'Maroon 5' and 'Lifehouse' are my absolute favorites, including all their songs.	I have many but Maroon 5 and Life House are my favorites, I like all the songs.	I have too many to count, but Maroon 5 and Life House are my favorites.	I have many, but Maroon Five and Life House are my all time favorites.
i love his music, its sad that ppl accuse him of molesting children	I am a fan of his music. It is sad that people accuse him of molesting children.	I love his music, It's sad that people accuse him of molesting children.	I love his music and think that it is sad that people accused him of molesting children.	I enjoy his music. It's terrible that he's accused of molestation.
You Love THEIR SONG which JUST SO HAPPENS to be THEIR MOST POPULAR.	You like the song which just so happens to their most popular.	You love their song, which just so happens to be their most popular.	You will love their song, which just do happens to be their most popular.	You're favorite song, happens to be their most popular.
Kinda sad, cuz I grew up with one.	It is a bit sad, since I grew up with one.	Kind of sad because I grew up with one.	That is a bit sad because I grew up with one.	It's depressing, I grew up with them.
eww....once again....eww.....if you want to see a hot guy look up ville valo or bam margera....	I do not find this attractive and recommend you research Ville Valo or Bam Margera to view a physically attractive man.	That is unsavory. If you want to view an attractive man, search Ville Valo or Bam Margera.	I would have to say that I find repulsive. My personal opinion of a really attractive man would be Ville Valo or Bam Margera.	Again, look up Ville Valo or Bam Margera if you want to see a concupiscent guy.
I've worked on yachts for the past 30 years & met lots of celebs.	I have worked with yachts for 30 years and I have encountered many celebrities.	I have worked on yachts for the past thirty years and have met many celebrities.	I have been employed on yachts for the past thirty years. I have met many celebrities during that time.	I have met a lot of celebrities while working on yachts for the past 30 years.
Mine would be Milli Vanilli and Vanilla Ice and Snow - YIKES!!	My choices would be Milli Vanillie, Vanilla Ice, and Snow.	I would choose Milli Vanilli and Vanilla Ice and Snow.	My choices would be Milli Vanilli, Vanilla Ice, and Snow. Yikes.	My answer would be Milli Vanilli, Vanilla Ice, and Snow.
Said, If you're gonna play the game, boy, ya gotta learn to play it right.	If you are going to play the game you must learn to play correctly.	If you are going to play this game, then you have to learn to play it right.	I was told that if I wanted to play the game, I needed to play it correctly.	"I said,  ""If you are going to play the game, boy, you better learn how to play it right."
Now there's hundreds of thousands of guys out there dreaming up a chance to date her.	Now, there are hundreds of thousands of males in existence dreaming of an opportunity to date her.	Now there are many men dreaming of going on a date with her.	Now there are many men who would like the chance to take her out.	Now, there are hundreds of thousands of men dreaming up a chance to date her.
rabbit feet only work on ppl, not the rabbit they came from	Rabbit feet only are effective for people, not the rabbit they stemmed from.	Rabbit feet are only effective on people, not the rabbits from which they come.	Rabbits fees are only effective for people, not the rabbits from which they come.	Rabbit feet only work on people, not the rabbit they were removed from.
techno it just grabs your spinal chord and makes it dance	Techno simply grasps ahold of your spinal cord and forces it to dance.	Techno, because it seems to grab one's spinal cord and make it dance.	Techno penetrates your being and makes you want to dance.	Techno - it feels as though it grabs your spinal cord and makes it dance.
This is sooo funny, it has perverted humor to it.	This is rather humorous, but it has perverted humor.	This is hilarious, it has depraved humor to it.	The is very funny, but in a sick vein.	This is so funny; it has perverted humor to it.
it is totally a chick show.	It is a completely feminine show.	It is a feminine show.	This is a show for a female audience.	"It is very much a ""chick"" show."
i also used to work in goverment.	I also onced worked in government.	As well, I worked in the government.	I used to work for the government.	I used to work for the government.
One guy says to me 'So, where's the fox from Mystic Pizza?'	"One male asks me, ""So, where is the fox from Mystic Pizza?"""	"One man stated, ""Where's the beauty from Mystic Pizza?""."	"The guy asked me where the fox from ""Mystic Pizza"" was."	Someone asked me where the fox from Mystic Pizza is.
If she's got a cane, then you can run and not worry about her catching you!!	If she has a cane, then you can run and not be concerned with her catching you.	If she uses a cane, then you need not worry about her catching you.	If she has a cane, she will most likely not be able to catch up with you.	If she uses a cane, you can run and she will not be able to catch you.
I still am and aaliyah was a good singer i miss them both	I still am, and Aaliyah was a good singer; I miss them both.	They were both great singers, I miss them.	I miss Aaliyah, she was a great singer.	Aaliyah was a good singer and I miss her.
Yo mama's so stupid, she thought Chubby Checkers was a game for fat people.	Your mother is rather unintelligent, she believed Chuby Checkers was an event for obese people.	You're mother thought Chubby Checkers was a game.	Your mother is not smart. She thought that Chubby Checker was a game for fat people.	Your mom thought Chubby Checkers was a game for over weight people.
yea we are trying ourselves to be a happy.	We are trying to be happy.	Yes we are trying to make ourselves happy.	We are trying to be happy.	We're trying to be happy as well.
Bit by bit.....you win my love.	You win my love, little by little.	Bit by bit you win my love.	You will win my love bit by bit.	Little by little, you'll win my love.
ive never heard of it sorry!	I apologize, I have never heard of it.	I apologize, I have never heard if it.	I'm sorry, I've never heard of it.	I have never heard of it, sorry.
STEELERS WHEELS, SEE THE MOVIE RESERVOIR DOGS LOL!	Watch the movie Resevoir Dogs.	"Steelers Wheels, you should see the movie, ""Reservoir Dogs""."	You should see the move Reservoir Dogs.	You definitely need to watch the movie Reservoir Dogs.
I would have to say White Chicks and Dumb and Dumber	"I would have to say ""White Chicks"" and ""Dumb and Dumber""."	I would have to say my two favorite comedies are White Chicks and Dumb and Dumber.	"I feel I must say ""White Chicks"" and ""Dumb and Dumber."""	I would have to say White Chicks and also Dumb and Dumber.
Hey that would be a good cartoon for Gary Larson...two pigs laying in bed watching Deliverance.	"Two pigs lying in bed watching ""Deliverance"" would be a good cartoon for Gary Larson."	A good cartoon for Gary Larson would be two pigs in bed watching Deliverance.	"That would be a good cartoon for Gary Larson: two pigs lying in bed, watching ""Deliverance."""	That would be a good cartoon for Gary Larson...two pigs lying in bed watching Deliverance.
Jerry Springer b/c David letterman is a pu$$y LOL	Jerry Springer because David Letterman is too afraid.	I prefer Jerry Springer over David Letterman.	I choose Jerry Springer, because David Letterman is weak.	Jerry Springer, because David Letterman is effeminate.
No Paris or Mandisa will win i'm sure	No, I am sure that Paris or Mandisa will win.	Paris or Mandisa will win.	No; Paris or Mandisa will win, I am sure.	No, I'm sure that Paris or Mandisa will win
Thank u. i'm bi 2, so thats y i asked.	Thank you; I am also bisexual so that is why I asked.	Thank you. I am bisexual, so that is why I asked.	Thank you. I am also bisexual, which is why I asked.	Thank you, am bi-sexual also, that is the reason I asked.
The Rock for hot steamy sex!	The choice would be The Rock for passionate romance.	The Rock would be an incredible partner.	The Rock is appealing in the sense of an intense sexual experience.	I would choose The Rock for hot, steamy sex.
cause you met them on the way, but that doesnt mean that they went with you.	And just because you met them during your travel, does not signify they traveled with you.	You met them on the way, that doesn't mean they followed you.	You became acquainted with them on the journey, although it is not equivalent to traveling with you.	Because you met them on the way, but that does not mean that they went with you.
Yeah sometimes when I need alot of help.	Yes, when I do need quite a bit of assistance.	Sometimes I need a lot of help.	Yes, during times when I require a significant amount of help.	Yes - sometimes, when I need a great deal of help.
must be mp3 and able to play on i tunes	Two requirements are that it must be an mp3, and be able to be played on itunes.	It has to be an mp3, so I can play it on iTunes.	It must be in MP3 format and able to be played on iTunes.	It must be an MP3 and able to play on iTunes.
Perfect Man Knows who I am and approves	The perfect man knows who I am and approves.	Perfect Man knows who I am and approves.	A perfect man knows whom I am and approves.	The Perfect Man Knows who I am and approves.
So far i haven't heard that shes come back here (Arkansas)?	So far I have not heard that she returned to Arkansas.	I have not heard that she came back here to Arkansas.	Thus far, I have not heard that she returns here to Arkansas?	So far I have not heard that she is come back to Arkansas?
he benn traveling all over the world and he became a aduld with alots of postcards	He has been travelling the world and became an adult with many postcards.	He has been traveling the world and became an adult with a lot of postcards.	He has been traveling all over the world, and he became an adult with multiple postcards.	He been traveling all over the world and he became an adult with lots of postcards.
Whats all these homies dissin' my girl?	Why are all these men being rude about my girlfriend?	What are all of these men insulting my woman?	What is all of these males insulting my female paramour?	What is with all these people insulting my girl?
Those being Rubber Soul, Revolver, Sgt.	"Those would be ""Rubber Soul,"" ""Revolver,"" and ""Sgt. Pepper's Lonely Hearts Club Band."""	"Those Beatles' songs ""Rubber Soul"", ""Revolver"", and ""Sgt. Pepper's Lonley Hearts Club Band""."	Those being Rubber Soul, Revolver, Sergeant.	Those being Rubber Soul, Revolver, Sgt.
Wow, that was a hard one.	Wow, that was a hard one.	That was an extremely hard one.	Wow, that is a difficult question.	That was a difficult one.
<3 i just love a Harry Potter, lol	I love Harry Potter.	I really love Harry Potter.	I really like Harry Potter.	I love Harry Potter.
I dunno... but I think they would be just as pathetic sounding as the Rolling Stones are now.	I do not know but I think they would be just as pathetic sounding as the Rolling Stones are now.	I do not know, but I believe that they would be as sad sounding as the Rolling Stones are now.	I am not sure, but I think that they would sound just as pathetic as the Rolling Stones are now.	I do not know, but I think they would sound as pathetic as the Rolling Stones are now.
how do u mean, let you get to you?	How do you mean, let you get to you?	"What do you mean by ""Let you get to you""?"	I am not sure what you mean.	"What do you mean by ""let you get to you?"""
me and my kids love that show!	My kids and I love that show!	My children and I love that show.	My kids and I love that show.	My kids and I love that show.
he just made me dinner :D	He made me dinner.	He cooked dinner for me.	He made me dinner, and it made me smile.	He just made dinner for me.
Hell yeah I listen to them every freakin morning!!!	I listen to them every morning.	I enjoy their music each morning.	Hell yes, I listen to them every morning.	Yes, I listen to them every morning.
the jeeney said they had 3 wishes, one for each of them.	The Genie said they have 3 wishes, one for each of them.	The genie granted them three wishes, one for each person.	The genie said they had three wishes, one for each of them.	The genie told each one they could have a wish.
Have you ever listened to Mad Season, if not you really should.	Have you ever listened to the band Mad Season? If not, you should.	I would recommend you listen to Mad Season if you have not already done so.	"Have you ever listened to ""Mad Season""? If not, you certainly should."	You should listen to Mad Season if you haven't.
ya sometimes but it funs reading thm and always remeber the +ve things forget the negatives	It is fun reading them and remember the positive things.	Yes, sometimes; however, it is enjoyable to read them and remember the positive aspects while downplaying the negative.	Yes, sometimes, but it is fun reading them and always remember the positive things and forget the negative.	It's fun reading them I try to remember the positive things and
girls feel that they have to be like celebrities or no one will like them but that's not true.	Girls feel like they have to be like celebrities or no one will like them.  That is just not true.	Females feel that they have to be celebrities or no one will like them. However, that is not true.	Young women feel that they have to be like celebrities or they will not be liked, but this is untrue.	Girls think they will only be liked if they look like celebrities, but that is just not true.
he's the gooofball in all of us	He is the goofball in all of us.	He is the funny one out of all of us.	He does not take himself too seriously.	He activates the goofy part we all have inside of us.
i don't/can't have an outgoing life.	I do not/can not have an outgoing life.	I do not have an outgoing life.	I do not and cannot have an outgoing life.	I just am not and cannot be an extrovert.
Pretty much quit in my late twenties.	I pretty much quit in my late twenties.	I quit in my late twenties.	I mostly quit during my late twenties.	I just about gave it up when I was in my late twenties.
Don't even get me started listing them.	Please don't ask me to list all of them.	Do not ask me to list everything.	You should not entice me to start listing them.	Do not even provoke me to begin listing them.
Manchurian Canidate and Mean Girls oh yeah Mona Lisa Smile	"Some of my favorite films include ""Manchurian Candidate"" and ""Mean Girls"" and ""Mona Lisa Smile."""	Some good movies are Manchurian Candidate, Mean Girls, and Mona Lisa Smile.	"""Manchurian Candidate"", ""Mean Girls"", and, of course, ""Mona Lisa Smile""."	"""Manchurian Candidate,"" ""Mean Girls, and indeed, ""Mona Lis Smile."""
He picked Sarah but rumour has it that they have already broke up.	He chose Sarah but, according to rumors, they were no longer dating.	He choose Sarash, but rumor has it they have broken up.	He chose Sarah, but rumors have been circulating that the relationship has already ended.	He picked Sarah, but it could be believed that they have already broken up.
tell you want to marriage him.	I suggest you let him know that you want to marry him.	Tell him you want to marry him.	Simply let him know that you want to marry him.	State that you desire to marry him.
GIRLFRIENDS IS ONE OF MY FAVORITE SHOWS.	"""Girlfriends"" is one of my favorite shows."	"""Girlfriends"" is one of my favorite shows."	"""Girlfriends"" are one of my favorite shows."	Girlfriends is one of my favorite shows on television.
Also, his gf is a singer!	Also, his girlfriend is a singer.	Also, his girlfriend is a singer.	Also, his girlfriend is a singer.	His girlfriend is a singer as well!
best buy has alot of hard to find movies and series	Best Buy has many hard-to-find movies and series.	Best Buy stocks many movies and television series' which are difficult to acquire.	Best Buy has many movies and series that are hard to find.	Best Buy has large selection of movies and series.
Do we really WANT them to get together?	Do we actually want them to get together?	Do we want them to be in a relationship with each other?	Do we want them to be together?	Do we actually want them to be together?
Could also try: Wedding Crashers or The 40 yr old virgin	"You could also try ""Wedding Crashers"" or ""The 40 Year Old Virgin."""	For a comedy you can also try Wedding Crashers or The 40yr Old Virgin.	"You could also try ""Wedding Crashers"" or ""The 40-Year-Old Virgin."""	"You could also try ""Wedding Crashers"" or ""The 40-Year-Old Virgin."""
shut up and drive by chely wright	"Chely Wright performed ""Shut Up and Drive."""	My favorite song is 'Shut Up and Drive' by Chely Wright.	"""Shut Up and Drive"" by Chely Wright."	"""Shut Up and Drive"" by Chely Wright."
there was a female brunette, a blonde, and a red head walking down a street.	A brunette female, a blonde, and person with red hair walked down a street.	There was a female brunette, blonde, and redhead walking down a street.	There were three women - a brunette, a blonde, and a redhead - walking down a street.	There was a female brunette, a blonde woman, and a red-headed woman walking down the street.
she saw a blonde on the other side.	She observed a blonde on the opposite side.	She saw a blonde on the other side of the street.	She saw a blonde on the other side.	She saw a blonde person on the other side.
i hope that answers your questions	I hope that answers your questions.	I hope that answers your questions.	I hope this answered your question.	I hope that answers your questions.
a gentleman with me, and a thug when needed hehehee	He should treat me like a gentleman would, and behave roughly when needed.	A gentleman was with me, and a thug when he needs to be.	He needs to be kind to me, and protective when need be.	A gentleman with me, and a protector when it is needed.
